start	end	text
5617	9303	Debating tonight, Joe Swinson, leader of the Liberal Democrats.
10465	12748	Nigel Farage, leader of the Brexit Party.
13710	14932	Labour's Richard Burgon.
16113	18217	Rishi Sunak of the Conservative Party.
19058	21161	Sean Berry, Green Party co-leader.
22103	24006	Adam Price, leader of Plaid Cymru.
24907	29194	And the leader of the SNP and First Minister of Scotland, Nicola Sturgeon.
41307	42168	Good evening.
42188	47273	There are less than two weeks to go in the election campaign, and the stakes could hardly be higher.
47333	58604	With Brexit in focus, the future of our NHS, and indeed our planet, there is now urgent interest, too, in the security on our streets following Friday's terror attack on London Bridge.
59345	69195	Some of you may have already cast a postal vote, but for the rest, there are 11 days to make up your mind, or possibly change your mind, before Election Day on December 12th.
69315	70656	We hope our debate tonight
70906	72709	will help you in your decision.
73049	76775	At home, you can take part using the hashtag ITVdebate.
77376	83486	And tonight, over two hours, your questions will be put to seven politicians, questions they haven't been shown beforehand.
83907	86211	And then they will have time to debate.
86391	90437	We invited the parties to send their leader or a senior representative.
90498	92280	We have five party leaders.
92821	96407	Neither the Conservatives nor the Labour Party decided to send theirs.
96758	104095	So we have Chief Secretary to the Treasury, Rishi Sunak, from the Conservatives, and Labour's Shadow Justice Secretary, Richard Burgon.
104115	109066	Before we start, each has precisely one minute to make an opening statement.
109427	115982	They drew lots to decide the order, and we start this evening with Sian Berry, co-leader of the Green Party.
117464	122091	We are in dark and dangerous times, and this election is about trust.
122111	125457	I know how many casually broken promises you've heard from politicians.
125958	129984	I joined the Greens after hearing too many of these myself 18 years ago.
130004	137616	I know you want real change this year, and things can change dramatically when you use your right to vote.
137596	140702	I'll be honest and say that Brexit would change things for the worse.
141183	144369	And I'll be hopeful and say that I believe you want that final say.
144951	149139	And that you and your children are crying out for real action to stop climate chaos.
149700	151043	That's what I stand for today.
151784	154389	For good ideas that build up communities for the common good.
154750	158237	For the Green New Deal we need to prevent disaster.
158217	171540	Our efforts together to do politics differently mean you have the chance now to elect more Green MPs, a louder voice for you and future generations, adding to the volume and the clarity that Caroline Lucas has been providing for a decade.
172021	175166	You can make history, shine a light in the darkness with your vote.
175747	176989	If not now, when?
179073	179854	Jo Swinson.
181437	184080	Boris Johnson can't be bothered to talk to you tonight.
184760	187763	He's leaving it to his cheerleader, Nigel Farage.
188424	191827	And if they win on the 12th of December, you lose.
192668	201597	Boris Johnson will start years of Brexit talks, stitch up deals with Donald Trump, pick on people weaker than himself and stoke divisions in our country.
202237	205000	And that's why Nigel Farage is happy to help him win.
205901	208103	I'm determined to stop them.
208083	211711	We deserve better than the Farage-Johnson-Trump nightmare.
212253	216022	Their plans for Brexit are not only about our place in Europe.
216703	218668	They're about the kind of country we are.
219429	220592	I love our country.
221254	222757	Our United Kingdom.
223439	226125	Open, fair and generous.
226105	229411	We are stronger working with our friends than standing alone.
230032	235562	Tackling the climate crisis, helping the vulnerable, celebrating the richness of our diversity.
235963	238788	If you want that brighter future, vote Liberal Democrat.
240631	241252	Rishi Sunak.
242554	246882	You, me, everyone is fed up.
247216	251260	Fed up with the way that Parliament has been paralysed by Brexit.
252021	254343	We just want to move on.
255224	257527	And with a Conservative government, we can.
258348	260490	We have a new Brexit deal ready to go.
260530	265856	We'll bring it back to Parliament before Christmas and leave by the end of January.
266716	270620	And then we can get back to focusing on your priorities.
271061	274945	The NHS, schools and safer streets.
275093	280163	But the only way to move on is to elect a Conservative government.
281005	294551	So let's end the delay and get Brexit done, because there's so much else that we have to do to move us forward, united, certain, and confident about our future.
294591	297557	Nigel Farage.
298145	305001	There has never been a time when confidence in politics, politicians and our institutions has been lower than it is right now today.
305021	311094	And that's because three and a half years ago, all the parties on this platform told you to vote Remain, but you didn't.
311535	312858	You said, we want to leave.
312898	316727	And three and a half years on, we find most of the parties here
316707	329070	still don't want to honour the vote, want you to vote again, some even want to revoke Article 50, and the Conservatives have had three and a half years to sort this out, yet they sort a half-in, half-out fudge.
329090	332657	I formed the Brexit Party because I want to get Brexit done properly.
332637	335099	I want us to become an independent nation.
335219	341125	That is what the vote was for, to leave the institutions of the EU and to be self-governing.
341806	346170	Once we've done that, that's just the beginning of a political revolution that needs to happen.
346210	348752	The Brexit Party are the new radicals.
348792	355638	We've got to reform our rotten institutions, the House of Lords, our voting system, corruption with postal voting.
356059	359522	Let's get back to being a proper, functioning democracy.
360312	360993	Nicola Sturgeon.
361413	364738	This election is the most important in our lifetimes.
365359	369865	At stake is not just Brexit, but what kind of society we want to be.
369885	374892	The SNP wants Scotland to be an independent, internationalist country.
375433	379819	And we are determined that the people of Scotland must have the right to make that choice.
380620	386067	But we also want to play our part in locking Boris Johnson out of Downing Street.
386047	390017	Make no mistake, if he wins a majority then the consequences will be dire.
390719	392825	Brexit will not in any sense be done.
393206	398740	Trade talks haven't even started and these issues will cause chaos for years to come.
399040	405369	In the rush for a trade deal with Donald Trump, the Tories simply can't be trusted not to put our NHS on the table.
405950	411719	They're also threatening to rip up rules on food standards, environmental protections and workers' rights.
412520	417908	To build a better future, we need to stop Boris Johnson and the Tories.
418429	421814	And in Scotland, that means voting SNP.
423997	424778	Adam Price.
425652	429457	Politics was already in a dark place, and it feels as if it just got darker.
429918	435746	But as Lukasz on London Bridge showed us, sometimes the worst times can bring out the best in us.
436587	440292	So how can we rediscover our lost sense of hope?
441134	444498	In Wales, it's difficult not to feel the opposite, the paralysis of despair.
444558	447022	We're going backwards from health to the economy.
447422	449525	And it's Labour that's been in power there for 20 years.
449565	450306	They're not the answer.
450807	452149	So what is?
452433	455320	Well for us it's not more Westminster, it's more Wales.
455720	459629	Elect MPs from the Westminster parties and they go there to fight each other.
460211	465021	Elect MPs from Wales' party and they'll fight for us with every breath.
465422	469311	Like my father when he was boxing champion, they'll punch above their weight.
469291	471836	To Westminster, we are invisible.
472417	475943	To us, Wales is invaluable because it's who we are.
476424	489306	Where others put Wales last, we will put our people first because it's our future, our mothers, our fathers, our daughters, our sons, because we want them to feel hope again in those beating Welsh hearts.
490649	491350	Richard Bergen.
491566	493749	Thank you, Julie, and everyone watching tonight.
494129	499676	Firstly, I want to express my condolences to everyone affected by Friday's attack.
500176	503400	This atrocity should give us all pause for thought.
503861	509768	None of us yet know the full details, so politicians should avoid knee-jerk responses.
510169	513733	But we do know that our justice system has been hollowed out.
514254	515455	Violent crime is up.
515856	517057	Our prison's in crisis.
517498	519480	Our police overstretched.
519460	523346	Listen to nurses and they'll say the same about our National Health Service.
523767	525449	Teachers the same about our schools.
525890	528073	Deep cuts to vital public services.
528434	529996	The fabric of our communities.
530437	536366	Happened at the same time the government made huge tax giveaways to the richest few and to big business.
536947	539652	Labour will make very different choices.
540112	545080	We will be on your side, rebuilding our country for the many, not the few.
546308	549231	Thank you all very much indeed for your opening statements.
549271	551513	Well, tonight's format is straightforward.
551613	558559	Over 1,000 questions were sent in by ITV viewers, and some of the questioners are here with us this evening in the studio.
558619	562683	I'll also read out some of the other questions we've had in during the course of the debate.
563124	565846	Also here, the people who will listen to tonight's debate.
565926	572252	Some of them have voted for these parties behind me in the past and are thinking of doing so again, and some are undecided.
572532	575235	All are very welcome here this evening.
575215	590256	Now, because of the tragic events in London on Friday, which saw two people killed in a terrorist attack, we've got a special question first related to security, which came in over the weekend from Darren Harris from Burnley.
590276	599229	How is it that a convicted terrorist has been let out after serving only half of their sentence to wreak the havoc that occurred in London on Friday afternoon?
600250	601712	Thank you very much indeed, Darren.
602013	607955	How is it that a convicted terrorist has been let out after only serving half of their sentence?
608035	613575	It is, of course, the priority of every government to keep its people safe.
614348	615750	Darren, thank you for the question.
615790	620758	Of course, my thoughts and prayers are with all of those affected by the tragic events on Friday.
620798	629872	And we saw the extraordinary bravery of the emergency services and the incredible resilience of those who responded from the community.
630573	634399	And the overriding job of government is to protect us.
634379	637083	That's why we're recruiting 20,000 new police officers.
637624	640208	It's why we've increased counter-terrorism funding by a third.
640449	648862	And it's why, to your question, within weeks of taking office, the Prime Minister announced a toughening up of sentences for violent criminals.
649323	661062	Now, to the case in point, the man in question, he was released due to a law that was passed in 2008 under the last Labour government, where people were released automatically halfway through their sentence.
661042	668195	We changed that law in 2012, and if he had been sentenced under our rules, he would still be in jail today.
668476	677252	But what I can tell you is, we will always back the police and the security services with the resources and the powers they need to keep us safe.
677312	680839	OK, Richard Burgon, can I come to you to answer some of the points that have been raised there?
681038	688172	Well, the thoughts of everyone are with the family and loved ones of the two innocent people who lost their lives.
688573	696068	It's not true that the only option at the time was automatic release halfway through the sentence.
696088	697892	There were other options available.
697912	699395	It's now not the case either.
699755	703182	But people don't want history lessons after this.
703162	704584	terrorist atrocity.
704764	728680	What people want is to put victims first and put keeping communities safe first and so we can't avoid asking tough questions in general about the Conservative decision to cut more than 20,000 police, about the chaos in our prison system where there are more and more assaults on prison officers and by the disastrous part privatisation and breakup of our probation service which is
728660	734564	looking after a quarter of a million people across our country in order to keep our communities safe.
734584	739463	We can't do security on the cheap.
740017	741679	Well, the facts are clear.
741959	745944	Under the rules that we passed in 2012, this person would not be out of prison.
746364	749868	And we have actually invested more in counter-terrorism and in the police.
749888	750629	But the key is this.
750870	752151	It's not just about resources.
752391	753352	It's about powers.
753953	756596	We want to do more stop and search, Labour opposes that.
757017	759259	We want to do tougher sentencing, Labour opposes that.
759500	761462	These are the things that will make a difference in our security.
761482	762463	Let me bring in Joe Swinson.
762443	768394	Well, Darren, in answer to your question, obviously it's wrong that that was able to happen.
769356	777813	No terrorist should be released without it being properly assessed whether or not they still pose a risk to the public.
777853	782241	So somebody like that just should not have been on our streets.
782221	784484	clearly these questions need to be asked.
784644	787107	We need to learn the lessons of this instance.
787208	801867	I think we also need to listen very carefully to the loved ones because there are families who are grieving and mourning and the father of Jack Merritt I think was very powerful in what he said which was
801847	813645	His son wouldn't have wanted this to be used as a pretense for some kind of draconian change in the law and I think we do need to listen to those loved ones too.
813727	816490	We all express our condolences, but nobody apologises.
817011	821676	Apologises for the fact the liberal elite have given us a ridiculous sentencing system.
821816	825821	I don't care whether these people were in jail for six years or 12 years.
826221	839937	If you have committed mass murder, or plan to commit mass murder, you're not just an ordinary criminal, you've got the virus of jihadism, and I think these people, Darren, should never, ever be let out of prison unless we're
839917	846712	absolutely convinced they do not have the jihadi virus but of course political correctness stops us from doing this.
846732	848736	So the Conservative government have got this wrong in your view?
849478	855811	The Conservative government have been very very weak on sentencing over the last 40 years just as Labour have been.
855932	857014	Nicola Sturgeon.
856994	864004	Well, firstly, my condolences and thoughts remain with the victims and all those who were affected by what was a horrific attack.
865086	870774	Clearly, the responsibility of politicians is to do everything we can to keep people safe.
871294	872496	He shouldn't have been out.
872516	874119	I think we can all agree on that.
874399	876422	There are lessons that will require to be learned.
876862	881449	But I don't think we do any service to victims or to the wider public
881429	893525	to rush to those conclusions or to have knee-jerk reactions and I frankly don't think Boris Johnson has done any service to victims in the crass way he has sought to politicise this issue during an election campaign.
894005	897870	The most serious offenders like this one should be in jail for lengthy periods.
897910	901395	In Scotland we have ended automatic early release for
901375	904320	prisoners sentenced to more than four years in prison.
904360	905662	I think that is right.
905742	909689	It should be up to the parole board to determine the safety of releasing somebody.
909749	916781	So there must be lessons learned here, but let's do it properly in a way that actually does do a service to those affected by this atrocity.
916801	920127	A quick response from Rishi Sunak, then I'll come to Sean Barry and Adam Price.
920107	928961	Months before this election campaign, within three weeks of taking office, the Prime Minister committed to toughening up sentences for violent criminals.
928981	932667	He's been a long-standing believer that our system lets out people too early.
932987	940178	And our view is that terrorists, those who have committed the most heinous crimes, should serve the full sentence that they are given.
940499	946468	That is a reasonable position that the British people would rightly expect, and with a Conservative government, that's what we will deliver.
946448	947029	re-offending.
947049	950434	There are 74 convicted terrorists out on our streets.
950714	955802	There are 400 returning jihadi fighters on our streets who've come back from Syria.
956122	959127	Surely whether they serve six years or 12 years isn't the point.
959207	963293	Why should they ever be let out again into society?
963273	966638	Well, our plan is for them to serve the full mandatory term of sentences.
966698	974929	The reason they couldn't be given indefinite terms before was because of the Human Convention on Human Rights, which overruled a UK ruling, and that is something that we've said.
974990	985264	If we were elected with a majority government, we will re-examine human rights law to make sure the balance between security and human rights is properly matched in favour of our safety.
985244	1002133	First of all to say that the way to really prevent and detect these offences is with a community who doesn't feel discriminated against working alongside the police in a cooperative way and we do need intelligence-led stronger policing in the community.
1002634	1010307	I work in London in the London Assembly I know that police cuts are real the police do not have time to get out of their vans into the community and
1010287	1012771	and work with people in a way that would really prevent this.
1012792	1024292	Now when it comes to people who've been recruited, who've been exploited, who are vulnerable to this kind of political ideology, we do need to have proper rehabilitation for them while they're in prison.
1024312	1029762	It's no good just leaving people to fester for longer in an overcrowded prison system.
1030023	1034050	We need real rehabilitation and it breaks my heart that Jack Merritt, who was
1034030	1039700	murdered was actually working on this exact thing of education and rehabilitation.
1040081	1046152	Those are the things we need to be funding more of, as well as real policing in the community that doesn't just alienate people.
1046312	1047774	OK, and Adam Price?
1047795	1054266	Well, I'd also like to express my deepest sadness that I feel for those that have lost their loved ones.
1054246	1058953	Look, I think there are serious questions that need to be answered seriously.
1058993	1073533	The 2016 report, the Aitchison report, which looked at this question of parole for convicted terrorists, it seems from the report authors' claims that the majority of those recommendations haven't been implemented.
1073593	1080202	The former director of public prosecutions here in the Northwest says that he raised these issues directly with the Prime Minister.
1080623	1083747	I don't know what happened as a result of that.
1083727	1085229	and I think it would be wrong to speculate.
1085289	1090314	We need sober reflection, not a rush to judgment in an election campaign.
1090374	1095960	And, you know, I think that maybe I'm old-fashioned, but at a time when terrorists are trying to divide us, I want to be the...
1095980	1099665	I want the Prime Minister, even in an election, to be the Prime Minister of all of us.
1099685	1112839	And I think the language that he used this morning, talking about a lefty government, not only showed a huge disrespect to those that have lost their loved ones, it did a disservice to a democracy, and he showed yet again that he's unfit to be Prime Minister.
1112819	1115142	OK, Rishi Sunak, respond to that point.
1115283	1118708	I think there's a very clear choice at this election when it comes to keeping us safe.
1118728	1120350	He's talking about the tone of the conversation.
1120370	1122493	We're trying to increase use of stop and search.
1122513	1126038	We're investing billions in our criminal justice system, and we want tougher sentences.
1126579	1131246	Jeremy Corbyn has opposed pretty much every single piece of anti-terror legislation that's come to Parliament.
1131466	1133329	They oppose the use of stop and search.
1133349	1138877	And John McDonnell signed a letter saying, and I quote, disband MI5, disarm the police.
1138857	1140859	There is a very clear choice about who's going to keep us safe.
1140879	1142061	OK, Richard Burgon, respond to that point.
1142141	1153814	I'm very uncomfortable with the way the discussion from the Conservatives moves straight from a tragedy to reheating pre-packaged political lines, smearing the Labour Party.
1153894	1156958	I think our democracy, regardless of our party, should be better than that.
1157238	1161263	The reality is the Conservatives have been in power for a decade.
1161503	1165067	They decided to cut the number of police by more than 20,000.
1165047	1170354	We'll recruit 20,000 more police, including 2,000 more than the Conservatives on the front line.
1170574	1172116	They've made a mess of probation.
1172417	1173598	Most people recognise that.
1173939	1180968	They've made a mess of our prison service so that people are coming out of prison more likely to commit crimes than when they went in.
1181348	1191882	Our priority needs to be reducing the number of victims of crime, not writing rhetoric-filled articles like the Prime Minister did in the newspaper this morning.
1191862	1200972	On this point that Boris Johnson, in some people's view, politicised the subject this morning with the way he spoke about the tragedy, Ritchie Sunak, how do you respond directly to that point?
1201633	1209381	I think it's incumbent on the Prime Minister of this country and a party in an election to explain to people how they will keep them safe if we form a government.
1209401	1217170	And on this issue, the Prime Minister, as I said, has been a long-standing critic of letting people, violent criminals, out of jail before their sentence is due.
1217450	1220974	He spoke about this three weeks after taking office.
1220954	1221776	Nicola Sturgeon.
1221796	1229793	He said this morning in the interview on the BBC that Parliament had blocked the proposals in his Queen's speech that would have led to tougher sentences.
1229833	1232038	Parliament actually supported his Queen's speech.
1232419	1238592	There is an obligation here on a Prime Minister, I agree with Adam, to try to bring people together in the aftermath of an attack like this.
1238572	1242076	not to seek to politicise it for party political gain.
1242116	1249324	But on these issues, of course, we have to reflect on what happens after an atrocity like this, but we also need to do more to prevent these things.
1249364	1252167	And that's where good community policing is so important.
1252207	1256292	The 20,000 cuts to police in England and Wales has been a disgrace.
1256312	1257994	We've increased police numbers in Scotland.
1258014	1265322	Let's get more police into our communities, helping to prevent these attacks, not just have us all standing here wondering how we react.
1265302	1272311	Is anybody else on the platform concerned that there are 74 convicted terrorists out on our streets and 400 returning jihadis?
1272331	1274253	Or do we just ignore it and pretend it's going to go away?
1274614	1276957	Surely, surely we need...
1276977	1278619	This is not just an ordinary criminal.
1278939	1281202	These people want to destroy our civilisation.
1281703	1283345	Surely they should be put in prison for life.
1284226	1285227	Thank you very much indeed.
1285247	1286428	Silence is golden.
1288151	1290373	Thank you very much indeed on that.
1290674	1293317	We're going to move away from the
1294040	1296749	dreadful events on London Bridge on Friday.
1296789	1302750	And move to our main part of the debate this evening, just a brief reminder of the rules to which all the parties
1303152	1303913	have agreed.
1304234	1312691	After each question is put, each leader or party representative has a chance to respond with a 45 second answer and the timing needs to be respected.
1312711	1315456	We'll then open it up for free-flowing debate.
1315656	1324173	Our first question is the backdrop to the whole election and that of course is Brexit and it comes from Manitha Aravind who's a student from Bolton.
1324193	1324654	Manitha.
1326001	1337518	Can you honestly say, and I do emphasise the word honestly, that your Brexit policy and your leadership will bring this deeply divided nation, and moreover, this deeply divided union, back together again?
1338560	1339461	Thank you, Namitha.
1339521	1345931	Can you honestly say your Brexit policy and your leadership will bring this deeply divided nation and union back together?
1346552	1347233	Rishi Sunak.
1348107	1350069	Our view is straightforward.
1350530	1353793	Three years ago, the British people voted to leave the EU.
