start	end	text
5002409	5006113	Who is ensuring most difficult winter for patients in the NHS for years?
5006133	5007094	What about this issue around the...
5007134	5010838	Yes, but on this point of the four-day week in the NHS, have you costed that in Labour?
5011099	5013922	It's not Labour's policy to have a four-day week in the National Health Service.
5014803	5016525	It has been one of those... Rishi Sunak?
5016565	5020650	John McDonnell stood there and said very clearly that it would apply to everyone.
5020630	5022312	Are you now saying that he was wrong?
5022812	5031702	No, I'm reiterating what he said before, which is the idea of people working a four-day week at some point in the future, in maybe ten years, is something which could be considered.
5031782	5034305	Thank you very much, all of our candidates on that issue.
5034325	5037188	It is time now to take just another little breather.
5037228	5048581	Don't go away, because in the final part of the programme, we'll be asking if these parties could possibly put their differences to one side and work together to solve some of the biggest issues facing this country.
5048681	5049962	We'll be back very shortly.
5063459	5066524	Welcome back to our final part of the ITV election debate.
5066564	5083915	Debating tonight, Lib Dem leader Joe Swinson, Labour's Richard Burgon, Green Party leader Sean Berry, SNP leader Nicola Sturgeon, Nigel Farage, the Brexit Party leader, Conservative Rishi Sunak and Adam Price, the leader of Plaid Cymru.
5084941	5091152	It is now time for our final question, and all the politicians will get the opportunity to respond, but they have to stick, of course, their 45 seconds.
5091552	5094978	This question comes to us now from Carly from Airdrie.
5096120	5100307	I'm 20 years old and really upset at the state of politics in our country.
5100988	5108882	The biggest issues facing us, like climate change and social care, need you to work together to find proper, long-term solutions.
5109683	5110645	Why can't you?
5112076	5113000	Thank you, Carly.
5113021	5115593	So big issues there, climate change, social care.
5115694	5116658	Can you work together?
5116779	5117462	Adam Price.
5118067	5124417	Thanks, Carly, for this question, because I think it goes to the heart of the dysfunction in a democracy at the moment.
5124737	5128043	Brexit has brought it to the fore, but it was deeper than that.
5128063	5128844	It was already there.
5129385	5134433	And, you know, we've got a 19th-century political system which is unable to address the 21st-century problems.
5134813	5137097	And, you know, no party has a monopoly on the truth.
5137157	5142225	We'll all have some valid perspectives, and we have to find a more collaborative system.
5142625	5146251	We have to adopt the sort of Citizens' Assembly approach
5146231	5151626	positive in Ireland as they looked at the change of the constitution over rape.
5151646	5159409	There are different mechanisms whereby we can have better conversations with each other and as a result of that we'll get better solutions for all of us.
5160050	5160432	Thank you.
5160953	5161675	Richard Burgon.
5162009	5168180	Well I don't believe that we can work as a Labour Party with the Conservative Party on virtually anything.
5168501	5184009	The reason being they've meant that more people are using food banks, they've made more people homeless, they've made the majority of people in our country pay the price for the political choice of austerity and it was deliberate.
5184350	5185452	I do believe we need
5185432	5192119	people from different parties, to back the interests of the 99%, not the super privileged 1% at the top.
5192420	5199087	But that requires all parties to make clear that they won't do anything to put the Conservatives in power.
5199427	5205414	People were very disappointed in the past when the Liberal Democrats said vote Lib Dem to stop the Tories, then they put the Tories in power.
5205714	5208537	Let's get the Tories out and let's get a Labour government in.
5208770	5209671	Nicola Sturgeon.
5209691	5213456	Well, some of these issues are the responsibility of my government in Scotland.
5213516	5220345	So, on a cross-party basis in Scotland, we've already introduced and protected free personal care to help with the social care crisis.
5220666	5234183	Just a few weeks ago, again, on a cross-party basis, we passed the most ambitious climate change targets anywhere in the world, and we're already making progress to meet those, although there's much, much more to be done, and it involves all of us working together.
5234224	5236887	So, I will always try to work with others
5236867	5242759	the political divide to make progress on these big issues that are so important, particularly for the next generation.
5242979	5257709	But if we are to make progress on these issues, I think the priority in this election is to vote in a way that ensures that it is not Boris Johnson and Nigel Farage running the show as of the 13th of December, because they are the roadblock to the progress on so much of this.
5257849	5258470	Thank you.
5260559	5263123	Thank you so much for this question.
5263183	5271215	I mean, this is the climate election partly because of the actions of young people who've done such a good job of bringing this to other politicians' attention.
5271435	5274961	They can't ignore you when you speak up as a school-age person.
5275021	5275702	It's fantastic.
5276022	5277384	But this is how Greens work.
5277404	5279347	You know, we're very rarely in power.
5279407	5281791	This is how I work on the London Assembly.
5281771	5285218	I try and get Sadiq Khan to carry out things that are in my manifesto, not his.
5285599	5292332	The Greens in Scotland, they hold Nicola's government to account and get good things like the new tax structures that you talked about.
5292793	5298885	We're used to doing this and we've tried in this election too to bring together parties to try and put together
5298865	5302232	some kind of agreement that we can actually try and stop Brexit together.
5302293	5305039	I think that was a constructive and grown-up thing to do as well.
5305059	5309969	And we do, we run councils with Labour, and we tried to get Labour to talk to us as well, and they didn't.
5310009	5311813	But I believe that we're trying to show the way.
5311833	5313938	Okay, that's 45 seconds.
5313918	5314860	Well, Carly, thank you.
5314940	5318368	I completely agree about the importance of tackling climate change.
5318468	5324240	And I think in this regard, it's amazing that our children are probably setting an example for us politicians.
5324341	5334222	I have two young girls, and they focus on the little things, turning off all the lights in our house, turning off the taps when they're brushing their teeth, and making sure everything goes in the right recycling bin.
5334202	5342635	And as a government, we've tried to do some big things, some of it in coalition previously, but we've made the UK the first place to commit legally to net zero.
5342975	5348563	We're leading the world in banning single-use plastics and being the first country to phase out the use of coal.
5348864	5359119	And whilst I think all of us on this stage might have slightly different approaches to how we get there, I think we all share the ambition of having a cleaner, greener planet to leave behind for our children.
5359460	5360361	Nigel Farage.
5360510	5362132	Well, Carly, politics is about choices.
5362453	5364796	So inevitably, people will have differing views.
5364856	5369343	And the electors decide who they want to carry out that policy for the next four or five years.
5369443	5372187	But I did in a previous question talk about the National Health Service.
5372368	5375272	There are areas where it seems everybody wants the same thing.
5375693	5384325	And when it comes to resolving the care crisis, when it comes to the National Health Service being free at the point of delivery, there is actually quite broad agreement across all the parties.
5384566	5388812	So there should be areas in which parties can work together.
5388792	5398452	Whilst everybody here agrees on climate change, I've got a slight issue with that, in that what we're doing is putting a lot of people out of work and making the poor give lots of money to the rich.
5398753	5402721	Yes, we want a cleaner planet, but I don't think the way we're currently doing it is right.
5402761	5405206	So there'll always be disagreement.
5405226	5406188	Thank you.
5406208	5410176	We need to let Jo Swinson have her response first.
5410831	5419942	I think one of the things about this election is it feels incredibly polarised and like everybody's just at each other's throats, but there's actually cause for optimism.
5420423	5426991	So Adam and Sian and myself, our parties are all working together in this election on the Unite to Remain Alliance.
5427011	5431557	We've been working together on stopping Brexit and although Nicola and I have our robust differences on
5431537	5432899	Scotland's rule in the UK.
5433200	5435804	We've also worked together on stopping Brexit.
5436065	5445660	I've worked with Rishi's colleague Andrea Ledsom, who I disagree with on most things, but I've worked with her on how we can try and stamp out harassment and bullying for staff working in Parliament.
5446001	5447183	And Richard's colleague
5447163	5453350	Stella Creasy have joined on many a feminist campaign and trying to protect women in terms of rights over their own bodies.
5453571	5462822	So I think there's a lot that we can be positive about where there's actually a lot of cooperation in politics, which can help us to work together on those big issues, including climate change and social care.
5463002	5463623	OK, thank you.
5463643	5465265	Let's pick up then with climate change.
5465285	5467888	Sian Barry, you were very keen to get back to Nigel Farage.
5467868	5477401	Yeah, I've no idea why you don't think that massive investment in new industries to retrofit all our homes, to sort out our transport system, wouldn't create lots of jobs.
5477522	5478543	Because our plans do.
5478583	5480826	They create 3 million jobs, our Green New Deal.
5480866	5481888	Just look at what's happened.
5481968	5492062	I mean, since we started putting in place green policies, and this country's done it worse than any other country, we've finished up with electricity prices 60% higher than most of our European competitors.
5492102	5494486	So no wonder our aluminium supply has dropped.
5494506	5495507	I challenge the idea that we've... No wonder.
5495527	5496188	No wonder.
5496168	5498492	We've got more policies in place.
5498512	5499875	We've had a Conservative government.
5500015	5503983	Our electricity prices are 60% higher than most of our competitors.
5504203	5506988	We've done it through green taxes and guess who pays?
5507209	5515003	The average family of four pays an extra £130 a year for their heating, increasing fuel poverty and rich landowners get given
5514983	5519837	Renewable energy is now the cheapest thing we can possibly invest in.
5519897	5521362	Why are the rich landowners still being paid huge sums?
5521382	5524491	Continuing to invest in renewable energy will make our energy cheaper.
5524531	5530107	Investing in energy saving will save everybody money on their bills.
5530087	5532990	You need a just transition, I agree with that.
5533050	5541036	But offshore wind right now is about half the cost of nuclear power, and yet these two parties here are still investing in more expensive nuclear power.
5541057	5542438	That doesn't make sense.
5542458	5547682	I think working together is a really good thing, but you've got to be working together for the right things.
5547742	5558011	So I don't think it was right for Joe Swinson and the Liberal Democrats to be in coalition with David Cameron's Conservatives and impose austerity and welfare cuts and vote for things like the bedroom tax.
5558031	5560093	So let's work together to do the right things
5560073	5565257	But on the issue of climate change then you were pointing to the gentleman either side of you, Ritchie Sooner.
5565406	5570252	Well, I don't think we're going to solve this problem by banning people from doing things or wrecking the economy.
5570453	5580767	What will solve this problem is going to be new technologies and innovation, whether it's more powerful offshore wind turbines, cheaper car batteries that drive faster, or cleaner, greener homes.
5580787	5590840	But the only way you can bring those new technologies to life is through a strong economy, which is why that strong economy has to be at the foundation of our greener future as a country.
5590820	5608733	Rishi, I have to pick you up on your record on this, because Liberal Democrats in government did make massive investments and change the industry for offshore wind in particular, which has helped to make us a world leader in offshore wind, but you reeled off a set of promises.
5608773	5609554	You said that
5609534	5615344	there's a net zero target but the Conservative government have got no plans on how that's going to be met and let's look at your record.
5615625	5622537	You sold off the Green Investment Bank, you stopped more onshore wind happening and you abolished the Department for Climate Change.
5622557	5624861	That shows the lack of priority you're putting on it.
5624881	5627526	I want to touch on social care very quickly but a quick response to that please.
5627506	5628848	I'm actually very proud of our record.
5628928	5633253	We are the country that has decarbonised faster than any other major economy.
5633533	5636156	We're leading the way in banning the use of single-use plastics.
5636176	5639240	And this year, we passed a very important milestone.
5639300	5645368	For the first time ever, we generated more of our power from carbon-free sources than fossil fuels.
5645388	5646769	So that actually is a record.
5646849	5648131	I'm very proud to stand on it.
5648151	5651095	Will you restore support for onshore wind if the Tories win this election?
5651115	5652256	Because you've taken it away completely.
5652296	5655640	It's about moving the support to the technologies which are new, which need the support.
5655620	5670675	I want to move on to a different question that was an element of Carly's question, that is about social care.
5670655	5672660	John from Milton Keynes has been in touch.
5672740	5676590	My wife has Alzheimer's and so far her care has cost over £105,000.
5678215	5685594	Why hasn't tackling the crisis in adult social care been a bigger priority and will that honestly change on December the 13th?
5685694	5687719	What is your plan, Rishi Sunak?
5688256	5691802	Well, we have a three-point plan to try and tackle this problem.
5691842	5697532	The first of it is to invest a billion pounds a year extra to deal with the immediate pressures in the system.
5697833	5704765	The second thing is explicitly to work on a cross-party basis to try and find consensus the way we have with the NHS.
5704785	5711817	And the third thing is to ensure that when it's reformed, no one will have to sell their home to pay for care.
5711797	5728675	Well one of Labour's policies is free personal care for older people as a start to create the kind of care service we need for our older people and other people suffering from dementia and other illnesses and also
5728655	5737445	we will be, of course, properly resourcing our National Health Service with £26 billion extra every year in real terms.
5737465	5739388	That's £40 billion cash.
5739728	5742692	Because our society is, thankfully, ageing.
5742972	5745275	People, by and large, are living longer.
5745415	5748979	So we need extra investment to ensure that everyone can live in dignity.
5748999	5757389	Yes, and there has been an observation made by all the stakeholders in the social care industry that there has never been a government in the last 20 years that has put forward a workable proposal.
5757429	5758290	Adam Price.
5758743	5763288	Well, I think this is one of the most important questions of this election.
5763328	5764529	I see it in my own family.
5764549	5777622	I see my 80-year-old mother having to try and negotiate the complexity of a means-tested system to care for, properly, for my 84-year-old father.
5777762	5782467	It comes to the basic question of whether we are a decent society.
5782927	5788733	And again, I don't mean to bang on about this, Richard, but why is it
5788713	5794220	when you're in government in Wales, you're not implementing, we have free social care in Scotland, why can't we have it in Wales?
5794240	5799607	You're talking about a national health and social care service, free at the point of need for social care in Wales.
5799927	5801770	You could do it in Wales now, why don't you?
5802451	5810000	We need, in Wales and across the countries and all the countries, we need an end to austerity.
5810180	5813725	The way to achieve that is to get a Labour government and I do wish that
5813705	5821413	Adam would realise that the people who have made the lives of people in Wales a misery is actually the Conservatives who have been in government for 20 years.
5821433	5821753	Thank you.
5821773	5822994	I just want to bring in Nigel.
5823115	5825137	You keep on saying, Richard, how disappointed you are in me.
5825177	5827559	Not half as disappointed as I am in your government in Wales.
5827980	5828360	OK.
5828380	5830282	If it's possible in Scotland, answer me this.
5830522	5833305	Why is it not possible in Wales where you're the party of government?
5834706	5835147	Why not?
5835427	5837890	Why isn't it possible, Richard Burgess?
5837910	5840252	There have been huge cuts.
5842747	5846111	There's been huge cuts to Wales from the government in Westminster.
5846211	5849975	There have been big achievements from the Welsh government in relation to NHS.
5850415	5850696	OK, thank you.
5850716	5851116	Thank you.
5851136	5851396	Thank you.
5851416	5852798	We just need to be brief.
5852858	5854400	Nigel Farage, and then a closing thought.
5854560	5855481	Very tough one, this.
5855861	5861487	You know, people with savings and houses are terrified that years in care mean they can't leave money to their children.
5862268	5865532	And yet, for the government to pay for all of it appears to be insurmountable.
5865852	5868555	I don't think anybody has got an answer to this problem.
5868635	5870577	Yet, I really don't think they have.
5870557	5871077	Jo Swinson.
5871218	5877263	Well, this is exactly the kind of issue that does need to have cross-party working.
5877603	5881326	And that has been set up in the past and then fallen apart.
5881346	5893177	And the Conservative government says they want to work cross-party, but you have delayed again and again and again the social care white paper and are not bringing it forward.
5893197	5899382	So it's all very well to now say you want to work cross-party on this basis, but Boris Johnson hasn't been bringing forward his plan on this.
5899362	5902747	I think, Julie, on that, look, this is a difficult issue.
5902767	5906894	As you said, 20 years, different governments of all stripes haven't been able to solve this problem.
5907255	5909078	We need to work together, we need to try and solve the problem.
5909098	5920176	But I can say this, if you think about next year, should we spend next year focusing on this kind of problem, social care or climate change, or should we spend next year arguing about Brexit with more referendums and years more gridlock?
5920396	5925104	The choice to get on to these issues is to get Brexit done and then we can start focusing on this kind of stuff.
5925424	5926045	Thank you.
5927459	5945162	It's extraordinary isn't it after nearly two hours that we're nearly out of time but actually on this point in the question about people working together it would be nice to offer all of us witnessing this election some hope that actually things could shift in politics and there could be some better ways of cross-party cooperation.
5945182	5946784	What hope could you offer for us?
5946764	5951250	I can stand here as the leader of a government that's already introduced free personal care.
5951270	5952111	It can be done.
5952572	5955315	Free personal care has existed in Scotland now for more than a decade.
5955556	5958740	My government's just extended it to those under 65.
5959080	5964227	These other parties here, they need to stop talking about it, and they need to get on and doing it.
5964548	5967051	And to be positive, I'm happy to answer them now.
5967031	5973341	OK, just on that, would you all here commit yourselves to working together on this issue?
5973381	5977086	Can I say that actually another cross-party commission isn't needed?
5977106	5979770	Yes or no, would you all commit to working together on this issue?
5979810	5980031	We said it.
5980051	5980632	We want to.
5980652	5981653	We said it in our manifesto.
5981813	5982154	Do it.
5982454	5984297	In our manifestos.
5984277	5987662	Well, the only way to end austerity is by getting a Labour government.
5987682	5992709	And we need to end austerity in order to properly fund our public services.
5992729	5994872	OK, we'll leave that question mark hanging in the air.
5994912	6000480	Thank you very much indeed, all of you, for taking part in those debates on these different subjects.
6000760	6003123	It's been a pretty lively debate.
6003143	6008230	And now it is time to have our closing statements from our politicians this evening.
6008250	6010133	And first, we go to Nigel Farage.
6010113	6011776	Well, I hope you've enjoyed tonight's talent show.
6011816	6019911	It's been a competition to see who can be the most politically correct, so therefore I must have failed here, but maybe not with you back at home.
6020432	6022816	You know, I set this party up earlier this year.
6023137	6025962	If I hadn't, I think Mrs May would still be Prime Minister.
6025942	6029586	I want us to become an independent country, to leave the European Union.
6029606	6033852	There's a bigger, more exciting world out there, our friends in the Commonwealth, America.
6033872	6040079	There's so much we can do, but we have to get Brexit done properly and then reform our political institutions.
6040099	6044124	And what I've seen tonight, there's no desire to change anything.
6044164	6055037	So we need to get some fresh, strong, non-PC voices into the House of Commons, and let's fight not just for Brexit, but let's try and change politics for good.
6055405	6056026	Thank you.
6056046	6057790	Wish you good luck.
6057810	6058832	Ask yourself this.
6059273	6064063	Do you want Brexit sorted in weeks or more referendums taking years?
6064965	6070297	Focus on the NHS, schools and police or more arguing about Brexit?
6071018	6074325	To move on or to stay gridlocked?
6074795	6076117	This is the choice you have.
6076798	6082685	Boris Johnson delivering Brexit by the end of January and focusing on your priorities.
6083486	6093358	Or Jeremy Corbyn ridiculously stuck in neutral on one of the biggest questions our country has ever faced.
6093378	6098425	Only the Conservatives can break this deadlock and set Britain free.
6099526	6100988	Thank you, Richard Burgon.
6101018	6102860	I want to thank you for watching tonight.
6103281	6105684	A vote for Labour is a vote for hope.
6106144	6125068	We are the party that created our NHS, introduced the minimum wage and will end NHS privatisation, introduce a living wage of at least £10 an hour and end the scandalous crisis in social care that leaves 1.5 million older people without the care they need.
6125048	6129798	A Labour government will support you and invest in your community.
6130159	6132404	We are on your side.
6132745	6138197	Let's bring real change to our country so that it works for the many, not the few.
6138557	6140762	Vote Labour on the 12th of December.
6141444	6142306	Richard Burgon, thank you.
6142606	6143428	Adam Price.
6143662	6148128	I could stand here on this stage tonight because an earlier generation gave me a chance.
6148669	6157281	Born in a council house, educated in a comp, free school meals kept me fed in the minor strike, and education was my route out of poverty.
6157821	6164491	There are children in Wales that will go to school tomorrow hungry, some of them without even a decent pair of shoes on their feet.
6164511	6166033	It doesn't have to be this way.
6166553	6171961	We could start to end child poverty this winter, not drop the target as Labour have done in Wales.
6172402	6173483	We could give
6173463	6178231	all our children, the best Christmas present ever, the gift of a better future.
6179052	6184542	If we do what we've always done and put our faith in the Westminster parties, that cycle of poverty will continue.
6185203	6191353	But if pride breaks through, we break that cycle and then everything for Wales becomes possible.
6191857	6192478	Thank you.
6192498	6193059	Sian Barry.
6193860	6195502	It's easy to fear the future.
6195642	6197825	The shadow of Brexit hangs over us.
6198206	6200569	Runaway climate chaos is getting closer.
6200889	6202992	And all around, there is inequality.
6203713	6206317	But despite all this, Greens don't fear the future.
6206477	6207739	We are the future.
6208399	6212345	You can trust us to keep our promises and hold the other parties to account.
6213086	6219454	Greens in Parliament will campaign for remain and let no government get away with more failure on climate chaos.
6219955	6221357	We can't afford it.
6222130	6225478	This election could be the last chance we have to transform Britain.
6225959	6227462	It's time to change course.
6227924	6230349	So vote Green, if not now, when?
6231472	6233316	Sian Berry of the Green Party, thank you.
6233416	6234098	Jo Swinson.
6234888	6238335	So what will Boris Johnson do if he wins a majority?
