start	end	text
2039144	2040747	Can we get real, please?
2041028	2041749	The deficit's halved.
2041769	2042591	The deficit's halved.
2042611	2043052	79,000 people...
2043072	2044976	It's doubled!
2045056	2046178	Thank you, Ed Miliband.
2046158	2051407	30% of young people in my constituency are unemployed.
2051507	2055895	I just want to say to people at home, you're going to hear a lot of scaremongering tonight from Nick Clegg and from David Cameron.
2056255	2057798	That's because they're scared you're going to kick them out.
2058579	2060803	Now look, I think there's a big decision for our country.
2061184	2064149	David Cameron wants to double the cuts in spending next year.
2064209	2066373	At home, you've got to make a decision.
2066613	2068977	Is that really a balanced plan?
2068957	2072685	I think that would put at risk the NHS, which has gone backwards under David Cameron.
2073005	2081342	I think it's much better to have a fair plan which says those with the broadest shoulders should bear the greatest burden, and we will make reductions in spending in order to balance the books.
2081362	2081703	Thank you.
2081723	2082344	Natalie Bennett.
2082364	2084148	There's been two issues covered here.
2084508	2086813	One is the issue of the debt.
2086793	2094780	And it's worth saying that over the past 100 years, about half of it, Britain ran a higher debt-to-GDP ratio, and no-one worried about it very much.
2095261	2097743	Because the question you have to ask is, why are you borrowing?
2098103	2111255	If you're borrowing, say, to build the new council and homes for social rent that we so desperately need, you know you're going to get a return far into the future if, as we want to, you end right to buy that asset is there for the future, for future generations.
2112076	2114438	And the second point about the nature of the cuts,
2115093	2119579	This has been borne overwhelmingly by the most vulnerable in this society.
2120340	2121281	The bedroom tax.
2121842	2125726	Two-thirds of the households affected by that have at least one disabled person in them.
2126327	2127609	Independent Living Fund.
2128069	2133556	18,000 of the most disabled people, the most vulnerable people in our society, their support slashed away.
2133616	2137061	We have to be a humane, fair, decent society.
2137361	2138803	We have to support the most vulnerable.
2139043	2139924	Natalie Bennett, thank you.
2139944	2140425	David Cameron.
2140405	2149982	The truth about this is we have cut the deficit in half, we need to clear the rest of it and we will do that in the coming years but only if we stick to the plan and the plan that is working.
2150002	2154530	But it is worth remembering as we debate cuts, why did these cuts have to happen?
2154590	2155933	What is the truth about cuts?
2156394	2157756	I have got the truth about cuts
2157736	2166808	here, this is a copy of the letter that Labour left in the Treasury when we arrived in government five years ago, and it says, I'm sorry, we've run out of money.
2167309	2169332	That is the truth of what happened.
2169372	2178664	So when people talk about cuts, we had to make these decisions because the British economy was on the brink, people were worrying about whether we'd be able to pay our debts, and the
2178644	2185272	The brunt of these cuts and the changes we've made, the top 20% have paid more than the reigning 80% put together.
2185653	2187896	But that's what happened when Labour were in power.
2187916	2191941	And my fear is if they got in power, they'd do it all over again.
2192101	2196486	You've increased national debt more in five years than they managed in 13 years.
2196606	2197387	Isn't that the truth?
2197428	2198629	We have cut the deficit.
2198649	2201833	The amount we borrow every year has come down.
2201813	2202454	Thank you.
2202474	2203454	There you go again.
2203515	2208439	You can't talk about the present and you can't talk about the future, so you want to talk about the past.
2208739	2213123	I think people at home will want to know what are we going to do for them in the next five years?
2213403	2214324	Not talking about the past.
2214484	2219209	You backed our spending plans until 2008, it so happens, but let's talk about the future.
2219529	2222311	Let's talk about the choices for working families in the future.
2222792	2227156	Are we going to have fairer taxes so that those with the broader shoulders bear the greatest burden?
2227176	2231820	Are we going to have common-sense reductions in spending or are we going to splash and burn as David...
2231800	2233322	as David Cameron wants to do.
2233382	2234424	Let me talk about the future.
2234444	2236587	We are going to train 3 million more apprentices.
2236607	2239470	We're going to build 200,000 houses for people to buy.
2239791	2244297	We're going to keep on with this reduction in unemployment that sees 2 million more people in work.
2244638	2248343	But we won't do it if we go back to the debt, the welfare, the spending and the taxes.
2248663	2250686	David Cameron, thank you.
2250726	2251547	Nigel Farage.
2251527	2252028	cut the deficit.
2252048	2253531	You have said what you are going to do and that is fine.
2253812	2256698	The question we started off with, how can they believe your promises?
2256998	2259864	You have failed in this government to eliminate the deficit.
2259905	2260626	That was your promise.
2260847	2262089	It is running at £90 billion.
2262149	2266238	Tell Johnny who asked the question, what are you going to cut?
2266298	2272050	We are going to find £1 out of every 100 that the government spends and save that in each of the next two years.
2272030	2281025	We've done it for five years, and if we do it for two more, combined with the extra taxes in terms of tax avoidance and tax evasion, we will eliminate the deficit.
2281045	2286874	But we'll do it without reaching into working people's pockets and taking their money, which is what Ed Miliband is recommending.
2286894	2289398	Let me put the point on the size of the deficit to Leanne Wood.
2289378	2294706	The deficit can be cut, but setting arbitrary deadlines is irresponsible.
2295347	2297591	Labour have voted for more austerity.
2297631	2303560	They voted for the austerity charter, which means another £30 billion worth of cuts.
2303580	2310331	And in the valleys where I live, we've yet to recover from the recession before last, let alone this one.
2310391	2313175	And your party, Ed, represents
2313155	2316200	many areas of Wales at all different levels.
2316501	2326739	Do you accept that you've failed people in Wales because we represent some of the poorest communities in the whole of the EU and your party is presiding over those communities?
2327079	2333070	No I don't Leanne and let me tell you about the differences between me and David Cameron because you've raised this point and it is an important point.
2333050	2337916	He refuses to have a mansion tax on the most expensive homes above £2 million to fund the NHS.
2337976	2339577	Instead, he chooses to keep the bedroom tax.
2340098	2341359	I'll have a mansion tax.
2341660	2345024	I'll also have a banker's bonus tax, put our young people back to work.
2345384	2359480	I will make fair choices, much fairer choices than him, and he wants to go much further on the deficit, he wants to go much further on spending cuts, and that will mean not just that we balance the books, but go further, and that will mean a crushing impact on public services.
2359460	2361243	And that's the choice for working girls.
2361463	2362885	Thank you, Nicola Sturgeon.
2362945	2369415	Our funding has been disadvantaged in Wales since 1978, when the Barnett formula was first invented.
2369755	2374502	When your party was in power and had an opportunity to sort that out, you didn't do it.
2374883	2375263	Thank you.
2375283	2380511	We deserve an additional £1.2 billion in Wales to take us up to parity with Scotland.
2380952	2383956	If you get into government, will you give £1.2 billion to Wales?
2384016	2387762	Let's just bring in Nigel Farage on that point, and then I'll come to Nicola Sturgeon.
2387742	2393789	I mean, the Welsh negotiated a very bad deal back in 1978, and the canny Scots negotiated a very good deal.
2394430	2407646	But this all has to be rebalanced, because, frankly, English taxpayers are a bit cheesed off with so much of their money going over Hadrian's Wall, giving people no prescription charges and no university tuition, whilst in England they're charged.
2407666	2413753	So there needs to be a rebalancing, and in the future, Scotland should receive less money per capita than it currently does.
2413813	2414374	That would be fair.
2414354	2423248	The Canny Scots have paid more tax per head of population to the Treasury in every single year for the last 34 years, that is the reality.
2423288	2435907	The question for Ed Miliband, Ed talks the language of anti-austerity but it is only a few weeks since Ed Miliband tripped through the lobbies of the House of Commons with Nick Clegg and David Cameron to vote for £30 billion of cuts over
2435887	2437048	the next two years.
2437349	2438710	I take a different view to that.
2438870	2442114	I don't believe you can simply cut your way out of deficit.
2442134	2443555	I think David Cameron has proved that.
2443575	2445938	He's missed all of his borrowing targets.
2445958	2449342	We need to invest and grow our way out of the deficit.
2449362	2453806	We've got experts saying that austerity has held back economic growth.
2453826	2459673	So let's have spending increases, modest spending increases, that allow us to invest in the things that matter.
2459853	2462676	We'll come back directly to Nicola Sturgeon.
2462716	2465539	Why did you vote for £30 billion of cuts, Ed?
2465519	2474775	that wasn't what the vote was for, in fact just two weeks ago we had a vote against Tory authority, your SNP MPs didn't turn up.
2474875	2480845	Let me just say to you Nicola, you've got a plan to cut six
2480825	2487092	billion pounds in Scotland for fiscal autonomy plans, and you need to explain what that will mean for the people of Scotland.
2487312	2491156	The reality is the SNP can't do just the same as Tory does.
2491176	2495761	On the point of the anti-austerity motion that Ed Miliband talks about...
2495902	2496662	Thank you, Nicola Sturgeon.
2496682	2498024	Nicola Sturgeon is absolutely right.
2498604	2504571	You have a choice in the two largest parties here between austerity heavy and austerity light.
2504551	2513303	and I think we need to, we've been talking, David Cameron's been talking a lot about the jobs he's created and let's think about the state of employment in Britain today.
2513363	2519211	One in five workers, more than 20% of workers is on less than a living wage.
2521074	2528324	People have been forced into self-employment not by choice because there's nothing else, 80% of people in self-employment are living in poverty.
2528725	2528905	We've
2536799	2539322	Austerity heavy or austerity light, Nick Flagg?
2539342	2540183	Well, just back to Johnny.
2540203	2542826	Look, of course you need to deal with debts and deficit.
2542846	2550275	If you don't, you simply make Johnny's generation and our kids and our grandkids pick up the sort of... ..pick up the bill for this generation's mistakes.
2550476	2551957	It's how do you do it?
2551978	2553599	And you've basically got the following option.
2553620	2558085	You either borrow too much money, which is Labour's plan, or you cut too much, which is the Conservatives' plan.
2558125	2562250	And when you cut, of course you do need to make savings, and no-one should deny that.
2562230	2563812	But it's very important why you do it.
2563832	2569960	And the difference between David Cameron and myself is, I believe you need to make the necessary cuts because you have to.
2570341	2575468	George Osborne and David Cameron make much further cuts than is needed because they want to.
2575568	2576990	And that's a huge difference.
2577010	2578192	That is just simply wrong.
2578292	2580795	What we've had is a balanced plan that's put more money
2580775	2581957	then don't depart from it.
2581977	2588987	It's also put more burden on some of the richest people, for instance, through having a stamp duty on expensive properties.
2589208	2595618	But what I'm hearing in this debate is that whereas I want to save one out of every £100 the government spends... Where do you...?
2595638	2606294	..to not put up taxes, what I'm hearing is more debt and more taxes, more debt and more taxes, a lot more debt and more taxes, some more debt and more taxes... May I ask a direct question to David Cameron?
2606334	2607355	..and definitely more debt and more taxes.
2607375	2608277	May I ask a direct question to David Cameron?
2608297	2609078	You're proposing, David...
2609058	2613330	You're proposing an additional £12 billion in welfare cuts.
2613350	2615255	Where are those cuts going to fall?
2615275	2616820	Who is going to pay the price of those cuts?
2616840	2624080	In the last Parliament, Nicola, we found £21 billion of savings in welfare because everybody knows that welfare
2624060	2626664	was overblown and needed to be properly dealt with.
2626724	2629628	Now, what is the alternative to making reductions on welfare?
2629929	2632372	It is putting up taxes and cutting people's pay.
2632392	2633053	But let's explain...
2633073	2635677	I don't want to see that happen, and that is what happened under the last Labour government.
2635697	2636378	Let's explain what that means.
2636398	2643989	One million people on disability benefit across the UK are going to lose £1,100 of their benefit.
2644009	2646333	That's not the kind of economic plan I want.
2646493	2650118	I want an economic plan that gets the deficit down but protects the vulnerable.
2650098	2653304	as I say, I think we should reprioritise government spending.
2653765	2654947	We should put the British people first.
2655628	2665546	And we should worry a bit less about propping up foreign regimes through a wasted £10 billion a year on foreign aid, which all of them agree to, for some reason that's completely beyond me.
2666468	2669153	And really, frankly, costing £10 billion a year net
2669133	2672176	to be a member of the European Union for no trade advantage whatsoever.
2672396	2681064	These are massive savings we could make, and we could actually... You know, some of the concerns about social spending and everything else, that's not where the cuts need to come.
2681424	2683046	Let's stop giving foreign money away.
2683066	2683346	Thank you.
2683366	2684427	Thank you, Nigel Farage.
2684487	2693335	Just to make it absolutely clear, we want to lift aid to 1% of GDP, increase the aid, because we need a more secure, stable world.
2693675	2699140	That means tackling hunger, tackling disease, supporting democracy and human rights.
2699120	2700542	What age should be for?
2700562	2700882	Ed Miliband?
2700902	2706128	I do think we've seen the choice tonight, Julie, because I've said I'll cut the deficit every year and we will balance the books.
2706348	2710933	I've said they'll have to be spending reductions outside key areas like the NHS and education.
2711373	2713175	David Cameron has an extreme plan.
2713496	2715958	He's failed in this Parliament and wants to go much, much further.
2716138	2720163	Now, I'm not going to stand on the stage tonight and say there don't need to be difficult decisions.
2720563	2724247	Cuts will have to come, but we can do it in a balanced way, we can do it in a fair way.
2724628	2728772	Thank you very much indeed, party leaders, on our first question this evening.
2729545	2732169	And our next question tonight is on the NHS.
2732189	2738017	It's an area where powers are devolved to the Scottish Parliament and to the assemblies in Wales and Northern Ireland.
2738037	2744426	This debate is about the election of the Parliament at Westminster, where MPs legislate on health matters in England.
2744586	2747250	And our question comes from Terry Kelly.
2748344	2753954	As a 63-year-old, I've grown up with the NHS and have recently retired after 30 years of working there.
2754395	2756318	So you can understand I'm strongly passionate about it.
2756999	2764392	My question is this, how will your party ensure long-term funding for the NHS whilst keeping it as a public service accessible to all?
2765254	2767017	Thank you very much indeed, Terry.
2767117	2769441	And I'll turn first to Nigel Farage.
2769640	2780386	Well Terry, like you, I care about the NHS because I've had so many scrapes in my life, I've needed it far more than most people and I think that when it comes to emergency care, it probably is the best in the world.
2780807	2783733	That doesn't mean there aren't some things that occasionally go wrong.
2784094	2785658	This whole question
2785638	2792389	of how we fund the health service with a population that's rapidly rising, with a population that is ageing, is a huge question.
2792449	2802405	We've had a big internal debate in our party about it and we've decided the best way to do it is to run it efficiently, to run it as a public service, free at the point of access.
2802586	2803427	But
2803407	2810135	to recognise that there has been a 48% growth in middle management of the NHS since 1997.
2810315	2814780	The Labour Party attempted to privatise large chunks of the health service.
2815241	2817383	That I also don't believe has worked.
2817663	2826934	I'd put an extra £3 billion in from savings to our EU contributions and I'd stop the tax on illness by ending hospital parking charges.
2827235	2828236	Nigel Farage, thank you.
2828256	2828997	Nicola Sturgeon.
2829017	2831620	In Scotland, we've already ended hospital parking charges.
2831780	2833582	Terry, this is a really important question.
2833602	2837307	The NHS is the most precious public service we've got.
2837367	2840110	I was Scottish Health Secretary for five years.
2840551	2844595	In Scotland, we've protected the budget of the NHS and we will always do so.
2845136	2851583	We also believe passionately that the NHS should always be run as a public service, not for private profit.
2851624	2852905	That's why we oppose
2852885	2872513	the privatisation that is happening in England, we oppose it in principle but also because it poses a risk in the long term to Scotland's budget and that's why SNP MPs in the House of Commons will take the opportunity to vote against any extension to privatisation in England and it's one of the many ways in which we'll seek to build progressive alliances
2872493	2874715	to protect things that matter to all of us.
2875116	2878559	But the best thing we can do for the NHS is to end austerity.
2878580	2888370	You'll hear the other parties tonight talk about increasing funding, but if they try to do that within the framework of overall spending cuts, then they'll have to cut even deeper elsewhere.
2888690	2894056	And anybody that tells you that cutting the social care budget or the welfare budget is good for the NHS is wrong.
2894096	2898601	Let's lift austerity, invest in the NHS, but without making deeper cuts elsewhere.
2898641	2899602	Nicola Sturgeon, thank you.
2899622	2900543	Natalie Bennett.
2900523	2907233	Well Terry, I think it's really worth noting how the NHS wasn't a huge issue in the 2010 election, but it's a huge issue now.
2907834	2915265	In 2010 we were well aware of the huge costs of the private finance initiative and how there was already a creeping privatisation of the NHS.
2915726	2923678	But what we've seen since then, particularly with the Health and Social Care Act, has been a race towards setting up the structures for privatisation.
2923658	2925903	Now what we say in the Green Party is very simple.
2925943	2928629	The profit motive should have no place in healthcare.
2929290	2934181	We're not happy with 5% of money that's supposed to be for healthcare going in profits.
2934521	2936826	We want 0% going in profits.
2937468	2940334	And to make our NHS more efficient,
2940314	2952655	To deal with some of its problems, what we need to do is take the whole market mechanism out of the NHS, the whole purchaser-provider split that the Health Select Committee in 2010 said was costing us £10 billion a year.
2953256	2963434	We need to put more money in, and in the Green Party, we want the free prescriptions they've got in Scotland, plus free eye care and free dental, but we need to look at the structures and say no private profit.
2963454	2965057	Natalie Bennett, thank you very much indeed.
2965077	2965798	Nick Clegg.
2966082	2968945	Look, we've heard lots of warm words here about the NHS.
2969005	2973130	Of course, we all love the NHS, but the NHS doesn't need warm words.
2973230	2974892	It needs hard cash.
2975353	2978737	And I'll give you the precise number of how much extra cash it needs.
2978757	2981920	It needs £8 billion by the end of the next Parliament.
2982201	2987667	That is what a man called Simon Stevens, who runs NHS England, he's independent of politics, has said it needs.
2987727	2991111	Now, the Liberal Democrats have a plan about how to find that £8 billion.
2991091	2999481	Unlike the Conservatives, we'll ask the richest to pay a little extra in tax for the NHS, closing the reliefs, for instance, in capital gains tax.
2999501	3007951	Unlike Labour, we'll also be able to put money in the NHS because we'll actually get the job done of balancing the books and then we can invest in the NHS.
3007971	3011735	That is the way to balance the books and invest in the NHS.
3011755	3014078	It means £8 billion more here,
3014058	3019712	£800 million more for the NHS in Scotland and £450 million more in Wales.
3019972	3025927	And my challenge to the leaders here is if you love the NHS so much, why don't you put your money where your heart is?
3026609	3027451	Nick Clegg, thank you.
3027972	3029215	Leanne Wood.
3029313	3034482	Plaid Cymru is proud that Wales gave the world the NHS.
3034582	3048587	It's probably one of the most important contributions of our modern age and it was based on a scheme founded by people contributing together to fund the health that they needed collectively.
3048567	3056221	The NHS is precious and it must be defended against privatisation and the NHS in Wales faces two threats.
3056802	3065277	One, from continued austerity and cuts, but two, from centralisation under Labour in Wales.
3065257	3075075	Plaid Cymru wants to recruit and attract an additional 1,000 doctors into the Welsh NHS to bring us up to the same level as the rest of the UK.
3075095	3076517	At the moment, we're way behind.
3076938	3082608	We have fewer doctors per head of the population than the vast majority of countries in the EU.
3083089	3086315	The NHS needs to be funded through general taxation.
3086916	3087998	Leanne Wood, thank you.
3088259	3089020	Ed Miliband?
3089000	3101392	Terry, like so many people around the country, I'm deeply concerned about what I see happening in our National Health Service, because we see people waiting longer for their test results, longer in A&E, longer to see a GP, longer to have an operation.
3101532	3102693	We've got to turn it round.
3103274	3108579	And when you hear from us leaders tonight, I think at home you should ask, where specifically is the money coming from?
3108960	3109480	I'll tell you.
3109780	3113364	We're going to have a mansion tax on the most expensive homes above £2 million.
3113905	3115446	That's a clear promise from us.
3115426	3123323	We're going to get money from those hedge funds who are engaging in tax avoidance and we're going to get money from the tobacco companies for a £2.5 billion Time to Care Fund.
3123684	3131201	That will hire 20,000 more nurses, 8,000 more doctors, 5,000 more care workers and 3,000 more midwives.
3131481	3133165	And it's not just more staff.
3133145	3140457	because it's also joining up services from home to hospital, taking on the biggest challenge our NHS faces, which is an ageing population.
3140658	3145105	Because if people can't get in to see their GP or can't be looked after at home, they end up in A&E.
3145306	3147229	It's a plan to turn the NHS round.
3148090	3149052	Ed Miliband, thank you.
3149072	3149753	David Cameron.
3149800	3153244	Well, first of all, thank you, Terry, for your incredible service to the NHS.
3153365	3154626	And you're absolutely right.
3154706	3159472	This is the most important national institution and national public service that we have.
3159993	3167302	And I'll never forget, as a dad of a desperately disabled child, what I got every night when I took him to hospital, worrying about his health.
3167382	3168864	I got unbelievable care.
3168964	3172669	And I just want that for every family and for everyone in our country.
3172649	3185208	Now, we've been talking about the difficult decisions we had to make to turn the economy around, but a difficult decision we made also was to go on funding the NHS, putting more money in every year, and we'll go on doing that in the next Parliament.
3185569	3196986	That meant that we've trained 7,000 more nurses, we've got 9,000 more doctors, and we also managed to take out of the NHS 20,000 bureaucrats, because I want the money spent on patient care.
3196966	3201633	Now, it's key that we keep a strong economy in order to fund a strong NHS.
3202013	3210525	And I want to see the NHS move to much more seven-day operation, like your GP being open eight in the morning, eight in the evening, all the way through the week.
3210686	3212007	There's one point I want to end on.
3212088	3219057	There's only one group of politicians anywhere in this United Kingdom who've cut the NHS in the last five years, and that was the Labour Party in Wales.
3219358	3222282	So when you hear Ed Miliband's promises, think about that.
3222565	3226261	Thank you very much indeed, party leaders, for your opening comments on that question.
