start	end	text
5764794	5773424	You have to accept that people will come here, we have free movement of people, and people will move out to other parts of the EU as well.
5773745	5785138	And we expect our citizens to be treated well when they move to other countries, and likewise, we must treat European citizens well when they come and live with us in our communities too.
5785118	5785840	Nigel Farage?
5786161	5788367	Well, at admission of the truth, that's fine.
5788387	5791175	I tell you, very interestingly, Anne, this actually worked rather well.
5791476	5800140	The free movement of peoples, when we were in with countries like France, Germany, the Netherlands, roughly similar living standards, roughly similar education and health systems,
5800120	5801682	it didn't really pose any problem.
5801942	5810914	The problem was, irresponsibly, stupidly, we let in ten former communist countries, where the minimum wage, say, in Romania, is about a tenth of what it is here.
5810974	5815360	And if you say to people in poor countries they can move to relatively rich countries, they do.
5815660	5819805	The Labour government, and I think Ed's admitted this, got it horrendously wrong on the figures.
5820226	5827275	But we now face the potential of a collapse in the Eurozone, and we have no control over the numbers coming to Britain.
5827255	5830839	Well, we did get it wrong, and I've said we got it wrong, and I've changed our approach.
5831160	5834584	But I do think there's a wider issue here about the opportunity for our young people.
5834644	5837387	Nick and David were saying how brilliant everything is on apprenticeships.
5837747	5840070	Take an issue, IT.
5840110	5850462	We bring lots of people into this country who are contributing to our country from other countries in IT, with specialist skills in IT, but apprenticeships in IT are actually falling in our country.
5850442	5862952	The answer is we should say that if you want to bring in a skilled worker from outside the European Union you must provide apprenticeships to the next generation because homegrown opportunity is an essential part of dealing with people's concerns about immigration.
5863032	5864054	Nick Clegg.
5864074	5865598	I strongly agree that apprenticeships
5865578	5878911	which is an old idea, the idea that you sort of earn and learn, that you learn the tricks of the trade while you're actually working on the shop floor, in the office or elsewhere, is a great old idea that we've given it new life.
5878971	5882955	We've got two million new apprenticeships created over the course of this last Parliament.
5883115	5894286	It's never been expanded on such a scale, and I think it is something that I hope all future Parliaments will continue with, because it is a fantastic way to allow youngsters to get their feet on the first rung of the jobs ladder.
5894266	5895649	Thank you very much, Nick Clegg.
5895669	5898537	Thank you very much indeed, all party leaders on that issue.
5899940	5905835	Now, if the arguments tonight have fired your political passions, you've still got time to register to vote on May the 7th.
5905955	5907599	You can do so online.
5907880	5911549	Now, our next question is from Rebecca Creamer.
5912643	5917428	I'm a 25-year-old graduate with a good job, but my generation as a whole have got it pretty tough.
5917989	5926519	It cost us more than our parents to go to uni, we'll work well into our 70s for smaller pensions, and higher rents make saving for our own home difficult, if not impossible.
5927540	5931645	We'll be less well off than our parents, and it feels like we're paying for other people's mistakes.
5932305	5937351	If you're elected, what will you do for my generation to help us feel optimistic about our future?
5938432	5940014	Rebecca, thank you very much indeed.
5940835	5941536	Leanne Wood.
5942174	5951450	Plaid Cymru believes that we need to invest in our young people, particularly in education, as that is the best route out of poverty.
5952011	5958141	You're right when you say that young people today are going to fare worse than the older generation.
5958682	5968418	And it's the first time for a long while that the generation of today is going to be worse off than the generation before it.
5968398	5980776	Plaid Cymru wants to provide free tuition fees for students, but because of austerity, we are not in a position to do that, even if we were running the Welsh Government.
5980796	5993595	We want to keep the tuition fee subsidy that is available for Welsh students, but we would like students to study in Wales so that we can invest that public money into Welsh universities.
5993575	6009841	but we would like some courses to be made available for free and I've talked earlier on about the need for doctors in the health service in Wales and we believe that we can attract more doctors by providing free tuition for those particular skilled group of workers.
6009861	6010763	Liam Wood, thank you.
6010943	6011584	Ed Miliband.
6011733	6019966	Rebecca, you speak for so many young people right across our country, so many young people I meet who are asking why they're paying the price of hard times.
6020467	6021789	And that's what we've got to turn around.
6022430	6024954	And that's what I'm going to do if I'm your Prime Minister.
6025515	6030923	Look, the first thing we've got to do is we've got to guarantee all young people access to a good education.
6030903	6033711	So you get a high quality apprenticeship if you get the grades.
6033731	6035656	That's a guarantee the next Labour government will make.
6036137	6043898	And we'll also cut the tuition fee from £9,000 to £6,000 because I don't want our young people drowning in debt when they leave university.
6044319	6046465	Next we've got to create good jobs for young people.
6046445	6053033	That's why we'll ban the exploitation of zero hours contracts and we'll say if you do regular hours, you get a regular contract.
6053594	6064287	And lastly, we'll build homes again in our country, 200,000 homes a year by 2020 and get a fair deal for young people in the private rented sector where many young people are being ripped off.
6064687	6068712	I believe in what I call the promise of Britain, that the next generation does better than the last.
6069072	6070314	I believe we can restore it.
6071175	6072016	Ed Milburn, thank you.
6072036	6072857	David Cameron.
6073090	6074634	Well thank you Rebecca for your question.
6074654	6075938	I think it's absolutely crucial.
6076098	6088011	I think the most important thing is to make sure there are good jobs for people to do and obviously in the last Parliament we've created 2 million new jobs and in the next Parliament we want to create 2 million more good jobs for people.
6088031	6089074	I think apprenticeships
6089054	6090456	and universities are vital.
6090536	6092998	I want our young people to have the choice of either.
6093319	6102089	So we're going to have 3 million apprenticeships in the next Parliament, but also we've uncapped university places, so whoever wants a place can go to university.
6102469	6109477	In terms of building homes, I want us to build homes that people can afford to buy, and that's what our starter homes are all about.
6109798	6114623	Put at 80% of the market price, not available to foreign buyers or
6114603	6118769	investment funds, but they're for British people to buy and to own.
6119050	6125560	And with our Help to Buy, that has helped about 88,000 people onto the housing ladder, we can make that a reality for people.
6125580	6140362	Now, I know it seems odd to answer a question from a young person about pensions, but actually it is important to be able to look forward to security and dignity in old age, and we've safeguarded the pension because people in our country should be able to look forward to dignity and security at the end of a hard-working life.
6140683	6141644	David Cameron, thank you.
6142406	6143327	Natalie Bennett.
6143307	6153409	Well Rebecca, we believe that education is a public good and therefore it should be paid for from general progressive taxation, far more progressive than we have now.
6154552	6155714	Just look at the facts on this.
6156456	6161046	Students on average now are leaving university with £44,000 worth of debt.
6162308	6165094	73% of them on current figures will never pay that off.
6165455	6170988	They're going through 30 years of their life for many people from roughly their mid-20s to their mid-50s.
6171809	6178765	Anytime you earn any sort of money at all, you're going to be paying a significant chunk of your income to a debt that you'll never repay.
6178745	6180628	And it's not like this system is actually working.
6180688	6185194	On current figures, again, 45p in the pound is never going to be repaid.
6185815	6195168	So we in the Green Party not only want zero university tuition fees, we also want to pay off student loan company debts so people don't have that weight of debt.
6195629	6203440	But of course, we also need changes in housing and jobs that you can build a life on, which is why we're calling for a minimum wage of £10 an hour by 2020.
6203600	6205102	Natalie Bennett, thank you.
6205162	6205663	Nick Clegg.
6205643	6208428	Rebecca, let me take the issue of tuition fees head on.
6208648	6215820	I, of course, famously, infamously, couldn't put into practice my party's policy on tuition fees, for reasons which I hope you're familiar with.
6215840	6220268	They were introduced by Labour and actually jacked up by Labour, and there was no money left.
6220608	6231567	But we did the next best thing, got the fairest deal possible, and thankfully now there are more young people going to university than ever before on full-time courses, and there are more young people from disadvantaged backgrounds.
6231547	6243237	But if I couldn't do that, I hope some fair-minded folk would at least acknowledge many of the other things that I'm very proud I have managed to do to give more opportunities, to create a stronger economy and a fairer society.
6243278	6247328	We've talked about more apprenticeships than ever before, the huge tax cuts,
6247308	6253861	which mean you pay nothing, no tax on the first £10,600 you earn as of next week.
6254422	6257669	Better money going to schools through the pupil premium for disadvantaged kids.
6257990	6260976	Healthy meals at lunchtime for little children at primary school.
6261276	6265986	These are the things which make a fairer future for future generations and I'm very, very proud of them.
6266347	6267068	Nick Clegg, thank you.
6267349	6268050	Nicola Sturgeon.
6268030	6269552	Well, I'm the First Minister of Scotland.
6269592	6278526	We're investing in a record number of apprenticeships, more affordable homes, and helping the poorest young people in our country stay on at school and college.
6278866	6283052	But we've also kept access to university free of tuition fees.
6283393	6285156	I grew up in a working class family.
6285496	6290764	I wouldn't be standing here as First Minister of Scotland without the free education I had access to.
6290744	6297816	As a politician now, I have no right to take that same entitlement away from the next generation of young people.
6298077	6304127	So I will always fight, work, vote, do whatever it takes to keep access to university free.
6304147	6308635	I think it's shameful for any politician who has benefited from that free education
6308615	6310237	to take it away from others.
6310578	6325240	So, SNP MPs in the House of Commons and the Scottish Parliament, anywhere else, will always support the principle that your access to education as a young person should be based entirely on your ability to learn and never, ever on your ability to pay.
6326141	6330027	Nicola Sturgeon, thank you.
6330047	6331129	Nigel Farage.
6331531	6335357	I think there's a section of young people in this country who are having a fantastic time.
6335657	6336378	Life is great.
6336398	6337280	They're full of optimism.
6338201	6338682	They're the rich.
6339663	6340164	They're the rich.
6340545	6346073	And they're the ones who go to the 7% of schools where their parents are wealthy enough to pay for their education.
6346093	6352303	And they are now dominating politics, the media, the arts, sport, in a way I haven't seen before.
6352323	6354146	And their families get richer and richer.
6354426	6358973	And the gap, the social inequality in Britain, grows with every single year.
6358953	6371392	By abolishing grammar schools, by abolishing selective education, what we did actually was to pull up the ladder on tens of thousands of young men and women every year who would have done better had they gone to a grammar school.
6371412	6380145	With university education, we encourage lots of people to go to university who actually weren't academic and have come out with debt and would have done better with trade and skills.
6380525	6382969	And to give optimism on housing, what I've said earlier,
6382949	6385579	We have to build a new house every seven minutes to cope with migration.
6385941	6389635	Let's cut the numbers and let's have a brownfield building revolution.
6389868	6391811	Nigel Farage, thank you to open the debate.
6391911	6393072	I'll turn to David Cameron.
6393293	6399581	Well, let me make a point about schools, because actually, under this government, we've got a million more children in good or outstanding schools.
6399642	6408754	And one of the reasons for that is we've opened up the state education system and encouraged great education providers, teachers and charities to come in and set up schools.
6408914	6411698	I was at one today, the Warrington Kings Academy.
6412139	6415183	Three times more pupils want to go than they can take.
6415163	6424426	And I think these free schools are a great institution but Ed Miliband's party says no more and is even contemplating shutting down some of the schools that are about to get going.
6424867	6432345	I say we need more good school places and whether they're academies or free schools or university technical colleges, that's what we need.
6432325	6434510	I want to come back to that point.
6434670	6437536	Why is the Conservative Party planning to cut the money for schools?
6437556	6441705	You're planning to cut over £3 billion out of the schools budget.
6441865	6443749	That is no way to guarantee fairness.
6443769	6447998	In the government over the last five years, your party wanted to cut money for schools.
6448279	6451566	We've got £7 billion for new primary school places.
6451546	6456211	With Nick Clegg, we sat in the Cabinet Room together, we took difficult decisions together.
6456232	6463480	Nick, I defend all of the decisions we took and I think your sort of pick-and-mix approach really is not going to convince anyone.
6463560	6474533	I remember vividly when your party wanted to cut spending for schools at the beginning of the last Parliament and I said no, because you don't make society fairer by cutting the money that goes to nurseries, colleges and schools.
6474513	6478597	I think they're both blaming each other and they're both right, Julie.
6478617	6483861	The thing I would say to David Cameron is, of course, his scares about free schools are wrong.
6483921	6489767	We do not want a system in the future which has unqualified teachers, 17,000 unqualified teachers in our schools.
6490007	6504520	But, look, there's a bigger issue, because Rebecca, who asked the question, was asking about young people going into the world today, and you've heard David Cameron and Nick Clegg defend a system which ensures that young people leave university with £44,000 worth of debt.
6504500	6507985	He didn't have to leave school with £44,000 worth of debt, nor did he.
6508286	6509207	Now, nor did I.
6509508	6511390	But the difference with me is I'm going to do something about it.
6511631	6512732	I'm going to cut the tuition fee.
6512933	6514395	Would I like to go further than £6,000?
6514455	6515477	Of course I would.
6515677	6518421	But it's a costed plan to reduce the tuition fee.
6518441	6523709	And, Nick, you describing a broken promise as the next best thing, I mean, I'm sure I'll remember that for the future.
6524270	6526053	But, you know, it was a broken promise.
6526173	6527014	You betrayed the
6526994	6528957	the young people of our country.
6530339	6533464	I get this pious stance from Ed Miliband.
6533484	6543781	This is the man who was part of a government that said no boom and bust in the economy and crashed our economy, jeopardising the future generations and life chances of millions of people in this country.
6544141	6547727	I have apologised, I have taken responsibility for the mistakes I have made.
6547767	6551533	Why don't you, in front of the British people, Ed Miliband, apologise for your role in
6551513	6554196	We said, no, no, don't say nothing euphemistic.
6554296	6557140	Say, I'm sorry for crashing the British economy.
6557160	6557560	Of course it worked.
6557580	6558021	Of course it worked.
6558041	6558281	Ed Miliband.
6558301	6558542	Ed Miliband.
6558562	6560304	Of course we said we got it wrong on bank regulation.
6562306	6564249	Absolutely we said we were sorry for what we did in relation to the banks.
6564329	6565831	And the banks were under-regulated.
6565871	6569255	But let me just point out, there was a global financial crisis.
6569275	6570236	And let me just point this out.
6570536	6575663	David, when you were in opposition at the time, as leader of the opposition, you were saying the banks were over-regulated.
6575863	6579107	So I'm really not going to take any lectures from you about the global financial crisis.
6579087	6586760	Ed Miliband still thinks the last Labour government didn't borrow enough, didn't spend enough, didn't tax enough.
6586780	6587802	I mean, that is the truth.
6587902	6589324	And young people suffer the most.
6589404	6598179	When you have an economy with out-of-control welfare, out-of-control debt, out-of-control spending, young people suffer the most because the deficit and the debt is on their heads.
6598199	6601024	No, they suffer the most when you have a Conservative Prime Minister making unfair choices.
6601044	6601705	Ed Miliband, thank you.
6601765	6602266	Natalie Bennett.
6602286	6603248	That's why they suffer, David.
6603268	6603609	Thank you.
6603669	6604470	Natalie Bennett.
6604450	6608596	I think we were talking about education, so perhaps we can go back there.
6608636	6622696	And to come back to the point about education, and particularly the point that David Cameron raised about free schools, we have a system brought in, supported with the academies of the former government, that were based on competition.
6623097	6625059	The idea is that schools compete with each other.
6625340	6626982	They fight against each other.
6626962	6629746	The Green Party, we don't believe that should be the foundation of schooling.
6629767	6631009	We should have cooperation.
6631309	6636197	We want to bring free schools and academies back under local authority control, have an overall cooperative system.
6636858	6644971	And much more than that, we need a school system that isn't focused on exams, that isn't an exam factory that shoves children through exam after exam after exam.
6645532	6652463	Children need an education for life and that means a much broader education, an education that includes things like first aid,
6652443	6656509	cooking, sex and relationship education, personal finance education.
6656789	6660034	We need a much broader education that prepares our young people for life.
6660054	6660975	Thank you very much indeed.
6661015	6661456	Leonwood.
6662077	6665322	In Wales there will be more cuts to education.
6665462	6669428	There will be a difficulty continuing the tuition fee grant beyond 2017.
6670569	6673253	If Labour win, they will cut
6673233	6677684	The Welsh block grant by 2.2% according to the IFS.
6677724	6681213	That's a billion pounds over the course of the next term.
6681774	6683960	And the Tories will more than double that.
6683980	6689554	So affording good education and job creation will be difficult under those circumstances.
6689534	6705838	That's why we must end austerity and if we are in a situation where there's a hung Parliament, Plaid Cymru will do all it can to end austerity, to rebalance power and wealth and to win for Wales parity with Scotland and then we too can afford
6705818	6708844	free tuition fees for students in Wales.
6709024	6720387	I think we have seen tonight from this discussion why we really need to break the old boys network at Westminster because frankly none of these guys can be trusted when it comes to tuition fees.
6720407	6722190	Nick Clegg, shamefully,
6722170	6723371	broke his promise.
6723391	6730219	But when you listen to Ed Miliband, remember that in 1997, Tony Blair promised no tuition fees and then introduced them.
6730239	6736406	In 2005, he said no top-up tuition fees and then after the election, top-up tuition fees were introduced.
6736446	6750102	If you want Ed Miliband, if he does get to be Prime Minister, to keep his promise on tuition fees and on the other progressive policies that he's now promising, then I would say hope there's some SNP MPs in the House of Commons keeping him honest.
6750082	6755208	Let's just return to the question, because Rebecca put a lot of issues into this question.
6755228	6757911	It wasn't just about education, it was about housing too.
6758291	6772748	It was also about possibly the younger generation paying for other people's... Can I just... On the housing point, it's a very important point, because Rebecca, I'm sure, is, in keeping with lots and lots of young people, worried that you're not going to be able to get your feet on the first rung of the property ladder.
6773489	6778114	The Liberal Democrats, we've got, I think, an idea which might help Rebecca, and it is this.
6778094	6782919	At the moment, lots and lots of young people can't afford the deposit to get a mortgage on a property.
6783099	6795571	So what we would do is we would introduce a rent-to-own scheme, where you wouldn't need to find the deposit to buy a house, but every time you rent, pay your rent at market rates, you'd build up a share of ownership in your home.
6795831	6799214	So by renting, you'd become, over time, an owner in your home.
6799534	6807662	I think that would be a great, great way, which we could introduce in the next Parliament, to give people like Rebecca that tangible belief that they can
6807642	6809867	hope to live in a home which they can call their own.
6810289	6811010	You keep on housing.
6811351	6813877	Yeah, well I think this is about demand and supply.
6813958	6815541	Markets are about demand and supply.
6815782	6822017	If you're having to build a new house every seven minutes to cope with 300,000 people a year net coming into Britain, you have a problem.
6822037	6823120	So that side of it.
6823100	6826725	A government, an independent government, can deal with that and reduce the numbers coming.
6826845	6829148	But we need to build lots and lots of houses.
6829408	6834095	The problem is that developers want to build on green field sites.
6834255	6835076	It is cheaper for them.
6835376	6836117	It is better for them.
6836598	6841805	And indeed, changes in the planning laws mean it's actually much easier for them to build on those sites.
6842225	6848854	I think what government needs to do, and I don't always want government to intervene, but I do think here government should supply grants
6848834	6862423	and actually make decontamination of brownfield sites something that is a big opportunity for developers and we could build 200,000 new houses a year on brownfield sites and solve much of this problem.
6862704	6865189	Housing is hugely, hugely important.
6865169	6879876	Scotland, as I know is the case in other parts of the UK, we are investing in schemes like help to buy and shared equity and taking a range of steps to help people, not just young people, but young people in particular, get their first foot on the housing ladder.
6880277	6881980	But we are also protecting a
6881960	6886850	affordable housing as well, and investing in greater numbers of affordable homes.
6886910	6894124	Because there are some people, even with the help of shared equity, will not be able, in the short or medium term, to buy their own home.
6894164	6901258	And we have a duty and an obligation to make sure we're providing good quality houses for rent as well, and that's really important.
6901378	6902280	Thank you very much, Ed Miliband.
6902260	6906285	I want to pick up on something that's very important to young people, which is renting in the private sector.
6906646	6908589	Lots of young people have this experience.
6908609	6909890	It's incredibly insecure.
6910311	6913015	It's sometimes substandard accommodation.
6913395	6916720	Now, we're the only party with a plan to get a fair deal in the private rented sector.
6917020	6919543	Three-year tenancies, not one-year tenancies.
6920224	6922227	Rent stabilised during that time.
6922207	6927392	and stopping letting agents charging tenants, because at the moment they charge tenants and landlords fees.
6927653	6931176	And that is a massive issue for young people all across our country, and we will act.
6931377	6936622	But it's all part of saying, look, we've got to stand up to some of these powerful interests and actually make our country work for young people again.
6936662	6937223	Thank you, Ed Miliband.
6937243	6940266	Let's just return to the final element of Rebecca's question.
6940286	6941808	She took in an awful lot of ground with it.
6942188	6947774	If you are elected, what will you do to help my generation feel optimistic about our future?
6947894	6948855	David Cameron.
6948835	6954343	Well, I think there is obviously it's been a very difficult time recovering from the appalling recession that we had.
6954423	6955344	It has been tough.
