start	end	text
754462	755343	Good evening.
755363	756304	I'm Julie Etchingham.
756525	762272	Here in the studio tonight are seven party leaders with different visions for the future of our country.
762472	767458	Over the next two hours, they'll debate head-to-head in front of our studio audience here tonight.
767879	773346	And tonight will be about some of the biggest issues facing Britain, questions at the heart of this election.
773907	778833	The main parties in England, Scotland and Wales are all represented here this evening.
779353	780655	The leaders are...
780635	782577	Natalie Bennett of the Green Party.
783298	785121	Nick Clegg, Liberal Democrats.
786082	788805	Nigel Farage of the UK Independence Party.
789726	791208	Ed Miliband, Labour.
792049	794873	Leanne Wood of Plaid Cymru, the Party of Wales.
795834	798157	Nicola Sturgeon of the Scottish National Party.
799098	801681	And David Cameron for the Conservatives.
809609	815898	Well, our questions are going to focus on some of the big political issues that we all care about and that affect everyday life.
815958	820184	You can get instant analysis of the debate online by going to our website.
820364	824509	And if you want to comment, the Twitter hashtag is Leaders Debate.
824930	833562	The leaders' positions in the studio and the order in which they make their opening and closing statements, as well as answer questions, has been decided by drawing lots.
834343	837287	First, Natalie Bennett, your opening statement.
838600	846053	You were told that austerity and inequality, bankers bonuses and tuition fees were inevitable.
846935	848377	They were not.
849719	851182	You all deserve better.
852344	855009	Let's put principles and values first.
855790	858094	That's why I got into politics.
859087	868559	The Green Party is determined to deliver a fair economy that does not make the poor and disadvantaged pay for the errors and fraud of the bankers.
869680	877650	We're committed to returning the NHS to its founding principles, no public money going into private profits.
879032	885600	We know we must take real action on climate change, the biggest threat facing us all.
886576	893230	Other parties trade in fear, fear of immigrants, demonising people on benefits.
894032	898862	But to build a decent, humane society, we start with hope.
899663	900485	Vote for change.
900886	902389	Vote Green.
902409	903672	Natalie Bennett, thank you.
904193	906137	And now we go to Nigel Farage.
906657	908661	There are six other party leaders on this platform tonight.
908681	913450	They may all look different, but actually on some of the big issues that affect this country, they're very much the same.
913811	919141	All six of them support Britain's membership of the European Union and most of our laws being made somewhere else.
919602	923710	And as a consequence of that, all of them support open door immigration.
924151	929121	Is it any wonder that trust in politics has broken down to the extent that it has?
929101	934192	Well, I represent UKIP and we believe in Britain and we believe this country should be a self-governing nation.
934272	936116	We believe we're good enough to do that.
936677	948763	And we also believe that open-door immigration has depressed the wages for ordinary people, made buying houses for youngsters very difficult, made it tough to get a GP appointment and not been good for this country.
948743	950066	We have a positive alternative.
950387	951730	Let's have a trade deal with Europe.
951971	954476	Let's cooperate with them as friends, but make our own laws.
954837	963718	And let's take back control of our borders and put in place an Australian-style points system so we can choose the quantity and quality of who comes to Britain.
964019	967647	By doing that, we'll give ordinary working people an even break.
968690	969191	Nick Clegg.
969752	973657	I think it's pretty obvious that no-one standing here is going to win this election outright.
973978	978124	So you're going to have to choose, like you did last time, who's going to have to work with whom.
978785	984573	Now, look, I'm not going to pretend that everything's perfect, though the country is in a lot better shape now than it was five years ago.
984593	986676	I'm not even going to pretend that I haven't made mistakes.
986856	990782	I have, I've put my hands up when I have, and I've learned from them.
990762	995951	But what you will get from me and from the Liberal Democrats is this.
996652	1002422	The grit and the resilience to finish the job of balancing the books and doing so fairly.
1002963	1005007	I will always act responsibly.
1005267	1007050	I'll never let anyone else
1007030	1011878	Borrow money that we don't have and jeopardise your risks, your jobs and our economy.
1012239	1015144	And above all, I will always act fairly.
1015424	1020212	I won't let anyone else impose ideological cuts on your hospitals and your schools.
1020573	1028266	And I will always serve the whole of our country, not just parts of our country, the whole of our wonderful United Kingdom.
1029688	1030810	Nicola Sturgeon.
1030891	1035523	This election is a chance to change the Westminster system so that it serves you better.
1036124	1039192	The SNP will always stand up for Scotland's best interests.
1039252	1041338	We will make Scotland's voice heard.
1041739	1047313	But I know that it's not just people in Scotland who feel let down by Westminster politics.
1047293	1053301	That's why my message to people watching in England, Wales and Northern Ireland is one of friendship.
1053662	1056605	I won't pretend I don't want Scotland to be independent.
1056966	1057286	I do.
1057687	1067140	But as long as Scotland remains part of the Westminster system, the SNP will seek to work with others of like mind across the UK to deliver positive change.
1067520	1071225	Like many of you, we want an alternative to the pain of austerity.
1071205	1076313	an end to the bedroom tax, a halt to the privatisation of the NHS.
1076693	1083844	And we believe the scarce resources of our country should be invested in the future of our children, not in new nuclear weapons.
1084224	1093778	A vote for the SNP is a vote to make Scotland's voice heard, but ours will also be a voice for new, better and progressive politics at Westminster for all of us.
1095180	1096302	David Cameron.
1096687	1099373	Five years ago, this country was on the brink.
1099734	1102019	We had millions of people unemployed.
1102520	1105847	And we had one of the biggest budget deficits anywhere in the world.
1106509	1111620	For the last five years, we've been working with the British people through a long-term economic plan.
1111921	1113083	And that plan is working.
1113524	1116130	There are almost two million more people in work.
1116110	1121544	It's a balanced plan, so we've invested in our NHS as well as reducing the deficit.
1121905	1124471	And we've cut taxes for 30 million working people.
1124953	1131790	And the plan's working because last year we had the fastest growing economy of any of the major Western countries.
1132462	1135890	Now tonight you're going to hear a lot of people claiming a lot of things.
1136551	1148378	But please remember these are the same people who claimed that if we followed our plan, unemployment would go up, that the deficit wouldn't come down, the economy wouldn't grow, that public services would be destroyed.
1148358	1150382	They were wrong then and they're wrong now.
1150423	1159422	The choice at this election is sticking with a plan that's working or going back to the debt, taxes, borrowing and spending that got us in this mess in the first place.
1159863	1161868	I say let's not go back to square one.
1162249	1163992	Britain can do so much better than that.
1165396	1166097	Leanne Wood.
1167410	1171195	I'm speaking to everyone back home in Wales tonight.
1171716	1180168	I'm from the Rhondda and I understand all too well the difficulties that have been faced by our communities in recent years.
1180929	1188540	You tell me that jobs and services have been cut to the bone and that they can be cut no more.
1188520	1191087	Plaid Cymru offers an alternative.
1191568	1198969	We offer hope for a decent future for our young people, for thriving, successful communities.
1199438	1207065	In a hung Parliament, Plaid Cymru can win for Wales, but we can only do that with your support.
1207846	1216775	I'm asking you to support Plaid Cymru, the Party of Wales, to make our communities in Wales as strong as they can be.
1217676	1223501	Please support Plaid Cymru to make Plaid Cymru Wales's voice in Westminster.
1225123	1226104	Ed Miliband.
1226489	1227190	Here's what I believe.
1228132	1230115	Britain succeeds when working people succeed.
1231036	1233040	But that's not the way it's been over the last five years.
1233861	1236626	For five years, wages haven't kept up with bills.
1237447	1239771	For five years, the NHS has been going backwards.
1240452	1245460	For five years, our young people have been fearing they'll have a worse life than their parents.
1246368	1247570	It doesn't have to be this way.
1248411	1257682	If I'm Prime Minister, I'll raise the minimum wage to £8 an hour and ban exploitative zero-hours contracts, so we reward hard work again in our country.
1258243	1262388	If I'm Prime Minister, I'll rescue our NHS, hiring more doctors and nurses.
1263049	1273843	If I'm Prime Minister, I'll build a future for all of our young people, saying to our young people, if you get the grades, you get an apprenticeship, and cutting the tuition fee from £9,000 to £6,000.
1273823	1276970	and will cut the deficit every year and balance the books.
1277993	1281541	Some people will tell you tonight this is as good as it gets for Britain.
1282444	1286854	I say Britain can do so much better than it's done over the last five years.
1288471	1291777	Party leaders, thank you very much indeed for your opening statements tonight.
1292799	1294603	And the format for tonight is simple.
1294683	1297288	Our audience will put their questions directly to the leaders.
1297528	1302438	Each will then have one minute to answer before we open things up for a free-flowing debate.
1302818	1305864	And our first question tonight comes from Johnny Tudor.
1307527	1311475	As a 17-year-old student of politics, I would like to ask,
1311708	1323304	How do each of the party leaders believe they'll be able to keep their promises of eliminating the deficit without raising certain taxes or making vast cuts to vital public services?
1324263	1325645	Jonny, thank you very much indeed.
1325746	1326146	Nick Clegg.
1326467	1328290	Jonny, I think it's all about balance, isn't it?
1328310	1345259	That's what I don't think that you should be faced, Jonny, with the stark choice of either cutting too much, George Osborne and David Cameron's plan is for £50 billion of cuts, way beyond what's needed, or borrowing too much, which is Ed Balls and Ed Miliband's plan.
1345279	1348144	They want to borrow £70 billion more than is necessary.
1348124	1350668	That's a dismal choice, cutting too much or borrowing too much.
1350708	1360945	It's a balance, and it does mean, yes, you need to reduce spending, but you also need to make those with the broadest shoulders the wealthiest to pay a bit more through the tax system to balance the books.
1361206	1374047	That's the way you can balance the books, do it fairly, also then, of course, put money into public services, perhaps most especially the NHS, which does need more money because of the fact we've got an ageing population.
1374027	1376797	So the Liberal Democrat plan is a very simple one.
1377258	1380951	We'll cut less than the Conservatives and we'll borrow less than Labour.
1382276	1383239	Thank you very much indeed.
1383319	1384122	David Cameron.
1384321	1388167	Well, first of all, what I'd say is that we've got a plan which is working.
1388207	1393997	We've taken 3 million of the lowest paid people out of tax, and we've got almost 2 million people back into work.
1394457	1400187	But I think what's absolutely crucial here is recognising that what our plan involves is balance.
1400387	1407038	We're going to go on investing in the NHS every year, as we have done under this government under the last parliament.
1407058	1409181	We'll go on doing that in the next parliament.
1409161	1413886	We're going to find savings of one out of every hundred pounds that the government spends.
1414286	1418110	And we need to do that for two more years, just as we've done for the last five years.
1418611	1422295	But the alternative to that plan is actually putting up taxes.
1422635	1424057	And I don't want to do that.
1424477	1434928	I think that if we go back to the tax, the waste, the spending and the debt, all the things that got us into a mess in the first place, we wouldn't help working people, we'd hurt working people.
1435229	1438392	That's what Labour did last time and we mustn't let it happen again.
1438777	1440502	David Cameron, thank you.
1442152	1448320	Under our plans, the deficit will be cut from £90 billion to £30 billion by 2020.
1448420	1454808	We see no reason to put arbitrary deadlines on cutting the deficit.
1455308	1457431	The austerity experiment has failed.
1457511	1463819	We were told that the deficit would be eliminated within this Parliament, yet debt has gone up.
1464400	1470387	We've faced all of these cuts, so much pain for so little gain.
1470367	1485388	The banks have had a bailout, it's time now for the people to have a bailout and it's time for us to invest in public services and job creation and to see an end to austerity and cuts.
1485368	1488893	the question is right, how can anybody believe these promises on cutting the deficit?
1488913	1493781	Because this coalition was put together to reduce the annual deficit to zero.
1494202	1496245	That's why these two guys got together.
1496545	1500031	It is still running at 90 billion sterling every year.
1500511	1504137	More remarkably, and what no-one talks about, is the national debt
1504117	1512388	which has been going on for hundreds of years and in this five years the national debt has doubled from £850 billion to £1.5 trillion.
1512408	1514690	We need to make cuts and there are some places we can start.
1515131	1518495	We could easily cut £10 billion a year from the foreign aid budget.
1518916	1524042	We could save another £10 billion a year by not paying over money to Brussels every single day.
1524383	1526125	We could end vanity projects
1526105	1532837	like HS2, that will only benefit a tiny number of people, thus saving, by the end of this Parliament, £4 billion a year.
1533258	1542095	And we need to revisit the Barnett formula, because, frankly, English and Welsh taxpayers are getting a rotten deal, and we could save £5 billion a year in doing that.
1542475	1544800	There's a plan and a promise that could be kept.
1545080	1546883	Nigel Farage, thank you very much indeed.
1546904	1547725	Ed Miliband.
1547823	1552169	Johnny, we'll cut the deficit every year and as I said in the opening, we will balance the books.
1552650	1556796	But we'll do it in a fairer and better way than has been tried over the last five years.
1557077	1559801	David Cameron promised to eliminate the deficit and he failed.
1560361	1562885	So what we'll do is first of all, we'll have fair taxes.
1563266	1569595	So we'll reverse the tax cut that he gave to millionaires, £43,000 for every millionaire in Britain.
1569575	1578084	Secondly, we will have common sense spending reductions, so outside key areas like education and health, spending will fall.
1578924	1580386	But thirdly, we'll do something else.
1581067	1590977	Because your living standards have fallen over the past five years, and that hasn't just been bad for working people, it's also meant that government hasn't had the tax revenues coming in.
1591377	1594300	That's why this government failed on the deficit.
1594280	1602530	So what we'll do is by boosting living standards, that's the third part of our plan, to live within our means, get the deficit down and balance the books.
1602811	1605741	It's a fair way, it's a better way for our country.
1606008	1607109	Ed Miliband, thank you.
1607309	1607930	Natalie Bennett.
1608450	1612594	Well, Johnny, I think what we're offering is not cuts.
1612874	1619179	We're offering the reversal of austerity, investing in your future and the future of everybody in this room.
1620300	1623283	And what we've been doing in looking at the deficit is looking at this the wrong way round.
1623483	1625825	We've been slashing away at essential public services.
1626605	1629328	And let's really think about what austerity actually means.
1630188	1635593	Probably somewhere near you, there's a children's centre or a library that's closed.
1635573	1638137	Think of a worker in, say, that children's centre.
1638698	1641944	She used to be providing an essential public service to your community.
1642545	1644568	She used to be paying tax and national insurance.
1645009	1648535	She had a modest amount of income to bring to spend in the community.
1649376	1651860	Now that essential service is gone,
1651840	1655224	She's on jobseekers allowance and everybody is much poorer.
1655765	1661532	So what we're saying is we do need to raise taxes on those who aren't currently paying their share.
1662053	1673207	Multinational companies in particular and rich individuals, if they pay their share in the world's sixth richest country, we can afford to have a decent society and accord to have decent public services.
1673525	1674707	Natalie Bennett, thank you.
1675128	1676110	Nicola Sturgeon.
1676130	1682321	Johnny, cutting the deficit is important, of course it is, but economic policy shouldn't be an end in itself.
1682401	1685126	It should be a means to people living better lives.
1685186	1689053	And the fact is, austerity is pushing people into poverty.
1689033	1693981	It's undermining our public services and it's holding back economic growth.
1694001	1698088	And when economic policy is doing all of that, that policy needs to change.
1698448	1702916	So I don't agree with the cuts proposed by the Tories, Labour and the Liberal Democrats.
1702956	1704057	I take a different view.
1704077	1707924	We should have modest spending increases over the next Parliament.
1708004	1714855	It will take slightly longer to eliminate the deficit completely, but the deficit would continue to fall in each year
1714835	1716177	of the next Parliament.
1716237	1730399	But crucially, that alternative plan would mean that we had resources to invest in infrastructure and skills and innovation, the things we need to get our economy growing, resources to invest in our public services and in lifting people out of poverty.
1730800	1740555	That kind of alternative plan must be better than a blind commitment to austerity that doesn't take any account of the damage being done to our society.
1740535	1742098	Nicola Sturgeon, thank you very much.
1742218	1745464	So you've made your opening statements on the first question tonight.
1745524	1749070	It's time to open the floor for you to contest one another's arguments.
1749150	1751655	And Nick Clegg, perhaps you could start the debate for us tonight.
1751675	1756924	Well, actually, I have a question for David Cameron, because he's just said to all of us that he wants to stay the course.
1756904	1759450	But of course, that's not what the Conservative Party want to do at all.
1760011	1768130	Remarkably, the Conservative Party have said they're not going to ask the richest in society to make a single extra penny of contribution to balancing the books through the tax system.
1768471	1773242	They want to impose ideologically driven cuts on schools.
1773222	1786404	When I hear the Conservatives talk about a choice between competence and chaos, just imagine, David Cameron, the chaos in people's lives, the people who in the NHS don't know whether you're going to find the money, the people who don't know whether their nursery or their college or their schools are going to close.
1786724	1787766	That's why Johnny's right.
1788066	1789970	You need to take a balanced approach.
1789990	1794177	You do need to reduce spending, but you also need to ask the richest to make a contribution.
1794377	1796901	It's the only fair way of finishing the job.
1796881	1811970	Well Nick is wrong about our plans because of course we are going to raise five billion from tax evasion and aggressive tax avoidance as we've done in this Parliament and that's part of the balance plan that also involves putting more money into our NHS and cutting taxes for working people.
1811950	1814875	The very wealthy include some of the tax avoiders and evaders.
1814915	1815777	But here's the point.
1816118	1819223	We've got to understand why the deficit matters and why we got here.
1819283	1826516	And the problem in the real choice is with Ed Miliband, who still thinks the last Labour government didn't tax too much, borrow too much, and spend too much.
1826817	1831866	And if you don't understand the mistakes of the past, you can't provide the leadership for the future.
1831846	1836370	I think not for the first time tonight, David Cameron's going to want to talk about the past, but he doesn't want to talk about the future.
1836611	1839313	But, David, you just said that you were tackling tax avoidance.
1839694	1841135	Let's look at the reality on this.
1841495	1843898	You haven't acted on the tax havens.
1843918	1845699	You haven't acted on the hedge funds.
1846120	1852626	We've shown how you can raise over a billion pounds as part of our £2.5 billion Time to Care Fund for the NHS.
1852926	1859052	It'll hire 20,000 more nurses, 8,000 more doctors, 5,000 more care workers and 3,000 more midwives.
1859032	1863098	You have to ask yourself at home, why won't David Cameron act on those hedge funds?
1863339	1865202	They fund his party, he won't act.
1865362	1869348	You need leadership that will stand up and act to tackle taxable... David Cameron... Once again, he's wrong.
1869408	1877140	Just this week, we've introduced a diverted profits tax to go after these companies that make money in Britain and don't pay tax in Britain.
1877160	1879143	But here's what Ed Miliband isn't telling you.
1879444	1886254	Because he doesn't support any of the spending reductions and efficiencies we've had to make, he wants to make a very big cut.
1886234	1895694	He wants to put up taxes and cut your pay, going into your monthly pay slip at the end of the month and taking your money out because he thinks he can spend that money better than you.
1895734	1901627	That would be a great mistake for our country.
1901607	1910504	It's really ironic, isn't it, hearing Nick Clegg and David Cameron argue when they've been hand-in-glove imposing austerity on the people of this country for the last five years.
1910804	1916215	David said in his opening remarks that everybody apart from him had been proved wrong over the past five years.
1916235	1917557	That's actually not the case.
1917537	1922470	David Cameron has missed his own borrowing targets by £150 billion.
1922891	1926019	His policies are pushing children into poverty.
1926039	1931413	There's a million additional children estimated to be going to be living in poverty in this country by 2020.
1931453	1933037	That is not right.
1933057	1934601	So what I want to do, I back Ed,
1934581	1937045	on raising the top rate of tax.
1937065	1941052	I also want to see us invest in the future of our children, not in nuclear weapons.
1941092	1942395	But I take a very clear view.
1942755	1946161	This country cannot afford more cuts in the next Parliament.
1946201	1950008	We need to see spending rise so that we can invest in the things that matter for us.
1949988	1958785	I'm sorry, I'm hearing half the panel saying that we have no economic problems with debt at all, and the other half of the panel saying that they've been prudent in government.
1958805	1965077	Look, there's no question that spending got completely out of control under Labour, and there are many that thought this coalition
1965057	1966378	would bring it back under control.
1966799	1970081	We have doubled the national debt in the course of the last five years.
1970362	1976647	Our debt repayment is bigger than our annual defence budget, and that's with interest rates close to zero.
1976907	1983894	We have a massive problem here, and it seems to me that nobody's prepared to admit that what we've done is we've maxed out the credit cards.
1984194	1989218	Yes, there's growth in the economy, but actually, at some point, we've got a dreadful debt repayment problem.
1989459	1994423	We've got to get real, and we can cut budgets like foreign aid with, I think, popular public support.
1994403	1996161	Let's turn that to Nick Clegg.
1996613	2003143	Well, I don't actually think making the poorest on the other side of the planet poorer still is necessarily the best solution to our problems.
2003183	2008511	But, look, it comes back to the simple issue of how do you balance the books but do it fairly?
2008852	2014340	I don't believe, unlike David Cameron and George Osborne, that you do it by just letting the very richest off scot-free.
2014380	2018226	Their plans don't involve a single extra contribution through the tax system.
2018486	2023995	I don't equally think it is fair to do what the Labour Party want to do, which is actually to increase borrowing.
2024035	2025557	That doesn't help the future generation.
2025537	2026940	Let's put that directly to Ed Miliband.
2026960	2031950	The way that you've done it so far, you've been balancing the books on the backs of the poor.
2031970	2034635	79,000... No, we've actually done it in a balanced way.
2034655	2035918	79,000 people...
2035958	2036839	The books aren't balanced.
2036860	2037601	We've got a £90 billion deficit.
2037621	2038042	79,000...
2038062	2039124	I mean, what's going on here?
