start	end	text
2561555	2562477	of that decision.
2562597	2564881	That's a basic issue of democracy, surely.
2564901	2566103	OK, thank you, Nicola Sturgeon.
2566344	2573236	We've also had a question from Gary in St Andrews on a subject of court that is very much part of this, and it is on the subject of immigration.
2573597	2577944	Gary asks, many EU migrants work in the coffee shops and care homes of our nation.
2577964	2581771	Will they still be welcome after we have left the EU?
2581791	2582753	Rishi Sunak.
2583104	2584906	Well, Gary, of course they will.
2585047	2587190	And I come from a family of immigrants.
2587210	2589032	My parents emigrated here.
2589533	2594780	I'm living, breathing proof that this is a welcoming, meritocratic, and tolerant society.
2595000	2599186	But it's absolutely vital that we have control over our immigration system.
2599206	2610741	And after we leave the EU, we can replace the free movement of people with an Australian-style points-based system, which allows us to decide who's coming here based on what they have to offer, not just where they happen to live as currently.
2610761	2611963	Will immigration be higher or lower?
2611943	2621942	Immigration will be lower, but the alternative to all of this, the alternative to control, leaving the EU and having control over immigration, is unlimited, uncontrolled immigration offered by the Labour Party.
2622122	2622383	Nigel Farage.
2622403	2627893	The population of our country has risen by 8 million since Tony Blair came to power in 1997.
2627873	2631819	And you can argue about people coming and working hard in coffee shops and all the rest of it.
2631839	2640311	The fact is, this massive increase in population has made our access to public services difficult, has compressed people's wages, and not improved our quality of life.
2640672	2648323	And frankly, I'm pleased you picked up the Australian-style points system from me, but I've got no confidence that anybody here genuinely wants to reduce the numbers.
2648343	2649865	OK, let's bring in Sean Barry, who wants to come in here.
2649845	2654831	The NHS is staffed by people from around the world.
2655071	2660858	Immigrants from around the world but also 60,000 people who come from other EU countries.
2660878	2668127	You're far more likely to find a doctor treating you in the NHS than you are to find an immigrant ahead of you in the queue.
2668147	2670249	This is one of the worst lists we've had to fight over the years.
2670269	2670830	Isn't that terrible?
2670850	2671891	Why aren't we training our own people?
2671911	2673173	Why don't we train our own people?
2673273	2674114	What's wrong with us?
2674094	2676720	We should train nurses and doctors, shalln't we?
2676740	2678584	I am proud to stand up for free movement.
2678604	2691472	I'm proud to stand up for the free movement we already have and I'm proud to stand up for the principle too, that the thought of an Australian style point system strikes fear into my heart because I know what it's like in Australia for immigrants.
2691553	2693537	It's a cruel system.
2693517	2698782	Firstly, I do want to say that I don't trust the Conservatives with migrants' rights.
2699082	2700904	They created a hostile environment.
2701204	2705588	They deported black people in the Windrush scandal.
2705929	2713596	And now they're chasing the votes of Brexit Party supporters in order to get Boris Johnson back into Downing Street.
2713876	2716138	We need to value migrants.
2716158	2722444	The NHS would flounder overnight if it weren't for people who have come to this country as migrants.
2722424	2725808	Very briefly, will we get freedom of movement under a Labour government?
2726088	2734419	If, in the EU referendum, the final say referendum that we have, the people vote to remain, then free movement in the EU will continue.
2734859	2741527	If people vote to take the credible leave option, then a new migration policy would need to be negotiated.
2741888	2745512	That would be fair and reasonably managed and put the needs of our economy
2745492	2756511	on our society first but also would show that we value migrants, we don't scapegoat them, we don't demonise them and we don't criticise them in order to try and get votes.
2756551	2765847	Thank you very much indeed and we'll just draw this section of our debate to a close and we know that it is also the backdrop to very many other questions too, we'll have some more on it in a moment.
2765827	2766308	issue.
2766569	2767410	It's very important.
2767431	2770397	It will also come into some of the issues that we'll discuss very shortly.
2770437	2772482	Thank you very much indeed for that.
2772762	2780359	After the break, as President Trump is about to arrive in the UK, we'll be discussing the special relationship and Britain's place in the world.
2795105	2797107	Welcome back to the ITV election debate.
2797167	2802834	In a moment, our next question, but remember, you can join the debate at home by using the hashtag ITVdebate.
2802874	2810603	A reminder that after each question, the seven politicians will have 45 seconds to answer it, and I'm hoping that they will stick to time.
2810623	2813667	We've got plenty of time to debate one another after those.
2814107	2820555	Now it is time for our third question on foreign affairs, and it comes from Lloyd Myatt from Stoke-on-Trent.
2821750	2828665	As Donald Trump arrives in the UK tomorrow for a NATO summit, should the special relationship become more or less special?
2829527	2831030	Lloyd Myatt, thank you for that.
2831270	2833114	A question about the special relationship.
2833495	2834798	First off, Jo Swinson.
2835689	2841278	Well, it seems like there's three people in the special relationship, Boris Johnson, Nigel Farage, and Donald Trump.
2842259	2853917	We obviously have a hugely important relationship with the United States, but make no mistake, the current occupant of the White House is not somebody who shares our values.
2853897	2868719	This is someone who has boasted about sexually assaulting women, whose policies are discriminatory against different people from different religious backgrounds, such as Muslims, and is separating parents from their children at the border.
2869220	2872064	And we should be very careful with that relationship.
2872104	2875749	The last thing we should have done was rule out the red carpet for a state visit.
2876130	2881638	And I think it's shocking that that's the way the Conservatives have chosen to develop that relationship with Donald Trump.
2881658	2882419	Nigel Farage.
2886500	2894651	When we talk about the special relationship, we're particularly talking about foreign policy, we're talking about defence, and indeed we're talking about security.
2895813	2907850	And I would argue that the special relationship is more important now than ever, because NATO itself is now directly threatened by a European Union that wants to do defence on its own.
2907830	2914358	You've only got to listen to what President Macron has said over the course of the last few weeks, what Mr Juncker's been saying, what Mr Verhofstadt's been saying.
2914658	2920285	The European Defence Union effectively has been set up to replace NATO, and we play a key role in this.
2920705	2923508	Boris Johnson needs to make a big decision in the next few days.
2923929	2929135	Are we staying with the European Defence Union, or are we staying with NATO and America?
2929455	2931458	And I hope we choose the latter.
2932178	2932539	Thank you.
2932919	2933500	Sean Barry.
2934408	2937655	Trump's rise obviously concerns me hugely.
2937675	2945553	It's not just his rhetoric, it's not just the use of populism, the use of hatred in his words, it's also his policies.
2945573	2950223	When you look at what's actually happening to children in his detention.
2950203	2954088	centres, I almost cannot cope with the thought of that.
2954829	2963361	When it comes to our relationship with America, I just hope that after next year, when Donald Trump is gone, we can fix that and build something new.
2963381	2977020	Because when I think about what we could do with that special relationship, with NATO's organisation, with its rapid reaction forces, and its logistics, and the kind of budget we're talking about putting behind Trident renewal,
2977000	2979527	which is 200 billion pounds.
2979547	2986707	The kind of peace project we could build with that kind of money and organisation, it's such a wasted opportunity.
2986957	2990043	My grandparents emigrated here because this is an amazing country.
2990524	2996254	We should be incredibly proud of the values that we stand for and the force for good that we are in the world more generally.
2996655	2998599	And that will always be the case under the Conservatives.
2998979	3005311	As it relates to America, I think the US is an important ally of ours, and it will always remain that case.
3005712	3006694	First of all, security.
3007175	3008357	We are kept safe.
3008337	3017087	because of the intelligence that our American allies share with us, and millions of jobs in this country are supported by the investments that the US puts into this country.
3017107	3020211	They're the single largest investor in our nation.
3020531	3035789	So it's important that the Prime Minister of this country is able to build alliances with world leaders around the world, like the President of the United States, and indeed, like all the relationships that he's built in Europe, that not only keep us safe, but further our British interests.
3036269	3036910	Adam Price.
3038105	3042194	You know, these are incredibly worrying times, aren't they?
3042535	3048930	We see the axis between Mr Farage, Mr Trump and Mr Johnson.
3049090	3051556	And that's the really frightening thing.
3051576	3054342	It's not just our NHS that is
3054322	3055223	a threat.
3055243	3056485	It's of fundamental values.
3056845	3064816	The President stands accused in the impeachment process of trying to use his political influence in Ukraine.
3065276	3067119	What are we seeing even this week?
3067179	3075570	The Prime Minister of this country, when he doesn't turn up to a channel for debate, saying he's going to revoke their licence.
3075550	3080178	It's the Trumpian future that's going to happen to this country unless we call it out at this election.
3080939	3090276	That's not the values that we want to see at the heart of our politics, but it's what's coming as a result of the special relationship, not between two countries, but between two men.
3090356	3090696	Thank you.
3090736	3091618	Richard Bergen.
3091868	3095152	Look at the Muslim ban that Trump brought in.
3095172	3096995	Look at the caging of migrant children.
3097255	3099178	Look at the way he threatens war.
3099378	3110894	And of course, he wants to conspire with Boris Johnson and the leader of the Brexit Party in order to get his fat cat friends to have access to our National Health Service.
3111094	3112476	That's not true, is it?
3112456	3121331	are what's happening in the United States of America under Donald Trump, then they should fear that that could happen here.
3121631	3136877	The only way to stop the UK becoming a new version of Donald Trump's United States of America is to ensure that Boris Johnson does not become Prime Minister at the end of this general election process on the 12th of December.
3136857	3137538	Nicola Sturgeon.
3137578	3144547	The relationship with America is important, of course it is, but when it comes to Donald Trump, we should sup with a very, very long spoon.
3145448	3149553	His rhetoric and many of his policies are deeply dangerous.
3150114	3156242	And the last thing the United Kingdom needs is a Prime Minister who's trying to be like Donald Trump.
3156903	3162730	We certainly shouldn't let him anywhere near our National Health Service, and I think it is at risk in a future
3162710	3167779	trade deal, the Tories, and Nigel Farage will say that's not true.
3167880	3170625	Well, if that's not true, let us put it beyond doubt.
3170645	3182227	Let's have an NHS Protection Act that makes sure our National Health Service can never, ever be on the table in a future trade deal, because Donald Trump and Boris Johnson, frankly, cannot be trusted with it.
3183910	3184110	Thank you.
3187600	3192027	So the question went to the heart of whether the special relationship should become more or less special.
3192068	3198919	Nigel Farage, there are clear and very vocal concerns about the character of Donald Trump which have been raised by some on this platform.
3198939	3202125	Jo Swinson initially raised them in her opening statement.
3202145	3205390	How do you respond directly to that and are you comfortable being his friend?
3205370	3208536	Well, Obama brought him a so-called Muslim ban, but no one criticised him.
3208877	3214448	He was the one that named the seven countries where a total stop on anyone coming into America should come from.
3214788	3215590	Trump implemented it.
3215830	3219518	And so these really, in many cases, are very, very false arguments.
3219558	3223065	Look, Donald Trump's style is very American.
3223445	3226872	It may not be to everybody's taste, but just think about this.
3226852	3230476	He is our most important friend in the world.
3230956	3242508	And at a time, at a time of huge global uncertainty, we should think about not just trade with America, but security, making sure that NATO is not destroyed by the European Union.
3242809	3243990	These things really matter.
3244010	3250717	And can I just say, the biggest lie of this entire election campaign is that Trump wants to buy the NHS.
3250997	3251778	He does not.
3252098	3254901	And he will say so, I'm sure, this week when he's here.
3254881	3258708	We're going to talk about that very shortly, but Joe Swinson wanted to come in on that.
3258728	3263857	Look, Nigel, you're just trying to defend Donald Trump.
3264158	3271431	You're saying these things aren't what he said, when we've all seen the footage of him talking and boasting about sexually assaulting women.
3271551	3275218	I was talking about Obama, and you're so Muslim about it.
3275198	3277864	Have you seen the footage of him boasting about sexually assaulting women?
3277884	3278185	I have, I have.
3278265	3280409	And it was crass, and it was crude, and it was wrong.
3280730	3282594	And men say dreadful things sometimes.
3282855	3284559	But the point here... That's just all right then.
3284819	3285300	No, they do.
3285581	3285922	They do.
3286363	3287425	But you know something?
3287445	3288086	Some men in particular.
3288247	3292175	If all of us were caught out for what we'd said on a night out after a drink...
3292236	3294741	I'm sorry, is that what you do on a night out after a drink?
3294761	3295182	Is that what you do?
3295162	3312948	What will you do on a date after a drink, Nigel? I'm sure you've lived the purest life of anybody. Come on, it's not purity to you. I've never said a word wrong about anything, anywhere. Nicola Sturgeon. I'm sure you're absolutely right. I'm sure you're absolutely right. I'm sure you're absolutely right. I'm sure you're absolutely right. I'm sure you're absolutely right. I'm sure you're absolutely right. I'm sure you're absolutely right. I'm sure you're absolutely right. I'm sure you're absolutely right. I'm sure you're absolutely right. I'm sure you're absolutely right. I'm sure you're absolutely right. I'm sure you're absolutely right. I'm sure you're absolutely right. I'm sure you're absolutely right. I'm sure you're absolutely right. I'm sure you're absolutely right. I'm sure you're absolutely right. I'm sure you're absolutely right. I'm sure you're absolutely right. I'm sure you're absolutely right. I
3312948	3318178	Listen, American politics is in fact more divided in many ways than our politics.
3318358	3324570	But all these false claims, you may not like him, he is president of the USA and that relationship matters.
3324791	3330822	You are so anti-American, you're prepared to put your hatred of Trump above our national interest.
3330802	3331984	And that's a big mistake.
3332004	3338115	Donald Trump, amongst many other things, demonises immigrants, so it's no wonder Nigel Farage really likes them.
3338135	3339457	Just like Obama before him.
3339657	3341621	Obama brought the ban.
3341641	3344005	You never attacked Obama, did you?
3344065	3345908	You never attacked Obama, not once.
3345888	3346989	We've got strongman politics.
3347009	3347209	Not once.
3347229	3350673	We've got Nigel Farage, we've got Boris Johnson, we've got Donald Trump.
3350853	3354717	That, in my view, is not what the UK, or any part of it, needs.
3355037	3358340	Donald Trump's attitudes, I think, are wrong and they're dangerous.
3358441	3361644	And in Boris Johnson, we've got somebody who's trying to be like him.
3361684	3364246	That, I think, is the wrong way to go.
3364387	3367910	And people in this country, people in Scotland, have a big choice to make.
3367950	3375878	Are we going to allow our future to be dominated and decided by the Trump-Johnson-Farage axis, or are we going to choose something much better?
3375858	3380907	for the future of our country, of this generation and those who come after us.
3384278	3386041	This is not a US presidential election.
3386061	3388265	We're here to debate the issues in British politics.
3388545	3389847	If you take a step back, why is he here?
3389887	3393673	He's here because of a NATO summit to discuss our security.
3394034	3396899	And that is something that is incredibly important.
3396919	3400925	The relationship we have with America is incredibly important for keeping us safe.
3401146	3404231	The intelligence that is shared keeps all of us safe every single day.
3404251	3406234	And that's not something to turn your nose at.
3406254	3407717	It's something that we should be welcoming.
3407837	3408338	But I'll say this.
3408838	3411062	It is important when we're electing a British prime minister
3411042	3416776	that they are someone who's not able to sustain that relationship, but they are also able to sustain those alliances that keep us safe.
3417076	3420945	NATO is something that I believe and my party believe is crucial to global security.
3421166	3426739	Jeremy Corbyn has described something that is a threat to global security and a danger that should be abolished.
3427023	3427364	Thank you.
3427424	3431071	I'm going to just bring in Adam Price, and then I'll bring in Richard Berger to respond.
3431092	3435561	The truth is, the words we use matter, whether in public or in private.
3435681	3438347	I mean, it can never be acceptable.
3438467	3441353	And if you think it is, you should be ashamed of yourself.
3441373	3443277	And look, who am I?
3443257	3451104	And the reality, the sad reality is this as well.
3451124	3459451	We have a Prime Minister who referred to gay men like myself, you know, as bum boys in tank tops, referred to Muslim women looking like letterboxes.
3459771	3467899	You know, this is actually creating the climate, right, where abuse becomes acceptable, whether it's abuse of women or of minorities.
3467979	3472503	And that's why neither Trump nor Boris Johnson are fit to be in public.
3472883	3472943	OK.
3475522	3477026	Let's respond directly to Adam Price.
3478670	3482499	Adam, I think when it comes to LGBT rights, the Prime Minister's record is very clear.
3482699	3484283	Oh, come on.
3484303	3484624	Oh, come on.
3484644	3484804	Come on.
3484824	3486949	He was the first... Defend those comments.
3486969	3488673	You can't defend those comments.
3488693	3489916	He did not mean to cause her offence.
3489936	3490718	Do you think the comments are wrong?
3490738	3491640	Nicola, I'm not trying to answer.
3492122	3493986	His record on LGBT rights is clear.
3493966	3498254	He was the first leading Conservative politician to come out in favour of same-sex marriage.
3498274	3501159	He rebelled against his party to repeal Section 28.
3501299	3507791	And as Foreign Secretary, he changed the rules so that pride flags could fly across our embassies all over the world.
3508072	3510456	So that is a record that I am proud to stand behind.
3510436	3514842	OK, can I... Just a moment, Jo Swinson, because I do need to bring in Richard Burgon on this.
3514883	3520270	And a particular question about your leader's relationship with the President of the United States.
3520330	3526459	Last time, when he visited the United Kingdom, he declined an invitation to attend a state dinner with Donald Trump.
3526480	3528883	Would you attend a dinner with Donald Trump?
3528998	3533385	I wouldn't attend a state dinner with Donald Trump.
3533405	3535669	I think Jeremy was right at the time to do what he did.
3535909	3547066	What we need in a Prime Minister and in a government is a government that, yes, has a good relationship with the United States, America and other countries, but also a government and a Prime Minister that thinks for themselves.
3547407	3553757	Jeremy Corbyn was correct to oppose George Bush's order that we should join the Iraq
3553737	3554258	war.
3554499	3569510	In the same way, Jeremy was correct to oppose the NATO-led bombing of Libya, which hasn't made things better in Libya, it's made things worse, it's caused a refugee crisis, there's human trafficking there, slavery has come back in Libya.
3569750	3572556	So yes, we need to be allies with the United States of America,
3572536	3575781	Our quarrel and difference isn't with the people of the United States of America.
3576201	3586256	Our quarrel and difference is with some of the policies of Donald Trump, who, like Boris Johnson, is a politician who's giving the green light to sexism, homophobia and racism.
3586276	3587799	OK. And that cannot be allowed to flourish.
3587839	3589000	Thank you, Richard Burgon.
3589321	3596492	I just want to bring in another question that pertains to this issue from David in Stoke-on-Trent, has asked a question about Trident.
3596532	3599396	Should we keep our nuclear deterrent and should we ever use it?
3599416	3600197	Jo Swinson.
3600667	3603231	I think we should keep a nuclear deterrent.
3603271	3606295	I don't think we need to replace it exactly as it is at the moment.
3606696	3618473	But I do think that we should have a nuclear deterrent in a very uncertain world while working hard for multilateral disarmament because that is so important to create a safer world.
3618453	3623819	You don't bring about nuclear disarmament by spending £200 billion on new nuclear weapons.
3623859	3628104	I would never press the nuclear button because it would kill tens of millions of people.
3628164	3634651	I think nuclear weapons are a huge waste of money that would be better spent on health and other public services, but I think they're immoral.
3634671	3638695	We don't countenance countries using chemical weapons any longer.
3638795	3643901	Why on earth should we countenance weapons that could wipe out swathes of civilisation?
3643941	3647565	They are morally wrong and it's time to get rid of them.
3649503	3659302	Well, in a world that has barbarous countries like Iran rushing as quickly as they can to get their own nuclear weapons, it would be madness to unilaterally get rid of ours.
3659363	3661046	And so, yes, we have to have it.
3661106	3665234	And with reluctance, yes, there may be circumstances in which we'd have to use it.
3665835	3666617	Richard Bargain.
3667171	3670917	Labour's policy is to renew Trident.
3670937	3679712	I have to say, in addition, I find it really troubling in a general election campaign where politicians are asked, yes or no answer, would you press the button?
3679953	3683358	And politicians smirk and say, yes, I'd press the button.
3683619	3686564	This macho politics to get votes.
3687024	3690310	I can't envisage what killing
3690290	3696337	being prepared to kill millions of innocent people would do to protect or make safe or more safe the British people.
3696357	3697338	Well, why have it then?
3697358	3698039	And I think...
3698059	3698219	Exactly.
3698379	3699020	Why have it then?
3699340	3700361	I think...
3700381	3707409	I think that politicians should stop boasting about their willingness to kill millions of innocent people just because they think it'll get them a few extra votes.
3707670	3710333	Well, why waste the money on Trident if you're not prepared to use it?
3710353	3712535	If you're never going to use it, don't waste the money on Trident.
3712555	3713036	Where's your bargain?
3713216	3714357	Come on, make your mind up.
3714337	3732143	My own views on the renewal of Trident are well known, the same as Jeremy Corbyn's, but the Labour Party's democratic incited policy is to keep Trident as a deterrent, not as something to boast about in election debates as being willing to press the button.
3732123	3735228	We would renew Trident, and if circumstances demanded, use it.
3735248	3740235	But I wanted to come back to... Richard reeled off a bunch of Jeremy Corbyn's behaviour in foreign conflicts.
3740576	3747546	The one that happened most recently was the chemical weapons attack in this country, in Salisbury, by the Russians.
3747887	3757181	When that happened, Boris Johnson organised the unprecedented expulsion of 100 Russian diplomats from 20 different countries with the support of the US.
3757421	3760105	And in that conflict, Jeremy Corbyn's idea was
3760085	3764131	to send the sample back to Vladimir Putin and ask, is this yours?
3764672	3767076	Is that the kind of leadership you want from a prime minister?
3767136	3767737	Very briefly.
3768078	3770141	I think that's, well, one, it's untrue.
3770201	3780237	But secondly, it's cheap because, actually, Boris Johnson has very serious questions to answer about his and his party's relationship, financial and otherwise, with Russian oligarchs.
3780217	3786005	OK, and just very briefly before we move on to our next question, against Trident, both Adam Price and Sean Berry.
