start	end	text
1354594	1357617	It's time we respected that and actually left.
1358478	1361702	And with a Conservative government, we can deliver that within weeks.
1362122	1366767	With the new Brexit deal that we've already agreed, we can be out by the end of January.
1367528	1368128	The point is this.
1368649	1377979	Whether you voted leave or remain, it's time for us as a country to move forward, not remain stuck in neutral.
1377959	1391115	So rather than spending more years going round in circles with more referendums and the division and delay that that would bring, Jeremy Corbyn propped up by the SNP, let's just get Brexit done.
1392458	1392859	Thank you.
1393160	1393842	Nicola Sturgeon.
1394092	1399483	Well, of course, the country I represent voted to remain in the European Union by more than 60%.
1399584	1412050	Even some people who voted to leave, and I suspect this is true across the UK, are utterly fed up of the mess that Brexit has become, of the chaos that we've seen played out over the last three and a half years.
1412030	1427654	My policy on Brexit, of giving people across the UK the opportunity to think again and to escape the Brexit mess, yes, I do think can help to bring people back together, because the biggest con in this election is the slogan from the Tories, that if they win this election, Brexit gets done.
1428315	1435686	We only move into the next and probably more chaotic part of the process, and, of course, a no-deal Brexit would be back on the horizon next year.
1436026	1439792	On the point about the union, it's not the sign of a strong union.
1439772	1443160	where Scotland can be dragged out of the EU against our will.
1443220	1449275	If Scotland is independent, we get to be in a partnership of equals with the rest of the UK, which is a much better position to be in.
1449295	1451781	45 seconds for each reply.
1451882	1452904	Adam Price next.
1453357	1455621	Look, the reality of it is this.
1455901	1458846	We were already a divided so-called United Kingdom.
1458906	1465296	We were divided by a huge chasm of wealth between the North and the South, between the West and the East of the country.
1465316	1472327	And many people, there will be many, many different reasons for voting Lee, but many people in the former Caulfield communities, like the one that I'm from,
1472307	1479197	voted for leave because they were exasperated at a Westminster political establishment that has never delivered economic change for them.
1479217	1483244	I have to be honest to people in the communities like the one that I represent.
1483264	1486148	Look, Brexit will not deliver the economic justice that we want.
1486168	1487450	It'll make matters worse.
1487470	1495362	It'll take the division that's already there and make it what it'll do to our economy, what it's done to our politics, divided the rich from the poor.
1495342	1497285	It will not be the answer to our problem.
1497305	1499468	Certainly don't take power from Brussels.
1499488	1500849	They're putting it in Westminster.
1500869	1503072	We'll do the opposite of economic change for Wales.
1503453	1503853	Thank you.
1504274	1504775	Jo Swinson.
1505756	1508900	Well, we need to resolve the chaos of Brexit.
1508920	1511324	We need to end the chaos of Brexit.
1511344	1520015	We've seen for the last three and a half years it's costing more than people ever thought, it's taking longer, and it's not anywhere near done.
1520496	1525062	There are so many problems in our country that do divide our country.
1525042	1533614	the inequality that for too many people it feels like it's just too hard to get by to make ends meet and we need to resolve those things.
1534075	1548855	But we know from the government's own analysis, from all of the economic analysis, that remaining in the EU will mean we have more money, we can invest more in our public services, we will be better able to improve people's lives and help to resolve that division.
1548835	1549336	Thank you.
1549396	1552303	Just a brief reminder of the question before we come to Richard Burgon.
1552323	1558137	Can you honestly say your Brexit policy and your leadership can bring this deeply divided nation back together?
1558178	1558679	Richard Burgon.
1558759	1566237	Our policy is about bringing people together and that's why as Prime Minister Jeremy Corbyn will play the role of honest
1566217	1581453	broker, as opposed to stockbroker like Nigel Farage and some of the people that back the Tories, and bring people together by giving it to the public to have a final say between a credible leave option that doesn't crash our economy and reduce rights or remain.
1581653	1591604	And whatever the result of that referendum, that final say referendum in the people, people have our word that we will implement it.
1591924	1595548	On one hand, we have the Liberal Democrats who want to ignore everyone who voted leave.
1595528	1601256	On the other hand, we have the Thatcherites in the Conservative Party and the Brexit Party who want to ignore everyone who voted Remain.
1601457	1603024	We want to bring this country together.
1603291	1603651	Thank you.
1603672	1604072	Sian Berry.
1604953	1613565	I understand completely the motivation behind the question, because we're all really just hoping that the country will stop being so divided.
1613625	1622357	And I have to say, I really, truly believe that the best way to finish off Brexit, to finish off this process, is with more democracy, with a people's vote.
1622617	1629687	And I think, I mean, looking around this panel, we've got a majority of parties here who are committed to putting back
1629667	1632291	the Brexit question in a people's vote.
1632391	1634194	I do believe that's the best way to finish it off.
1634535	1636919	And I do believe that Brexit would be a disaster.
1636959	1644711	The reason I want to get a people's vote done is so we can get back to fixing the country, to dealing with the problems that austerity caused.
1645232	1654627	And I don't think we can trust the Conservatives with another vote in this election, another government, because they've had three years, they've made a hash of Brexit, and they cannot be trusted again.
1654687	1655128	Thank you.
1655148	1655809	Nigel Farage.
1655789	1663239	Well, Sean, you beautifully illustrate why there's division in the country, because the political parties, and most of Westminster, don't accept the result of the people.
1663979	1667504	Losers' consent is the principle by which civilised democracy works.
1667524	1670328	You fight elections, you lose them, you accept the result.
1670448	1672430	That is how our system works.
1672450	1674593	We have had three and a half years, and you're still doing it.
1674974	1678438	You don't accept the result, and now you want a second referendum.
1678418	1681583	just to give even more division and acrimony in the country.
1681683	1687732	And I've no doubt that when we vote to leave again by an even bigger margin, you still wouldn't accept it.
1688113	1690436	There's no perfect answer, given where we are.
1690877	1693060	But we have to deliver Brexit.
1693121	1698268	We have to become an independent country or our democracy in this country is, frankly, dead.
1698889	1700111	Thank you very much, all of you.
1700131	1701854	First, come to Richard Burgon.
1701954	1705219	Will another referendum really bring this country back together, in your view?
1705402	1706783	I think it can do.
1707224	1716313	We've had a Brexit crisis created by the Conservatives, only one of the many crises they've caused, a crisis of living standards, homelessness, zero-hours contracts, and the rest of it.
1716333	1718315	I think it can bring people together.
1718635	1723520	And actually, our society isn't divided between people who voted Leave and who voted Remain.
1723840	1726703	Some politicians try and exploit that and make that into a division.
1726964	1735392	Whether people voted Leave or Remain, they need an end to 10 years of Conservative-Liberal Democrats' austerity, which has held communities back
1735372	1737957	including those that voted Leave.
1738038	1739920	Well, we hear Labour's policy here.
1739940	1743024	They want to have another referendum on a deal that they're going to negotiate.
1743185	1745447	But they can't tell us who's going to actually support this deal.
1745728	1747430	Jeremy Corbyn said he's not going to support it.
1747630	1749873	We haven't heard from Richard or anyone else that they're going to support it.
1749973	1750874	It's ridiculous.
1751215	1757643	And all this means, all this more dither on Brexit from the Labour Party just means more delay, more division, and more deadlock.
1757663	1759245	That won't move our country forward.
1759525	1761168	It will just hold it back.
1761268	1761848	It's not a deadlock.
1761888	1762209	It's a deadlock.
1762229	1765513	Just very briefly, we know that your leader wants to remain neutral on this issue.
1765573	1767015	Where are you on this, Richard Burgon?
1766995	1769358	Well, I'll speak to my local... Where are you on it?
1769458	1770279	Where will you campaign?
1770299	1770540	I'll answer.
1770560	1770800	That's OK.
1771060	1778571	I'm going to speak to my local Labour Party members after a Labour government comes back with that deal, that improved it, and then we'll decide how we approach that.
1778591	1783818	But the point is there's been a big fixation on what this politician or that politician thinks.
1783838	1789706	The point of a people's vote is the people whose opinion matters is the people's opinion on this.
1789946	1796715	And by taking the position he has, Jeremy Corbyn shows he's determined to bring the country together and heal divisions
1796695	1801823	not try to exploit them for votes as the Lib Dems, the Conservative Party and the Brexit Party.
1801883	1806972	Richard, by taking the position that he is, Jeremy Corbyn shows that he's a bystander, not a leader.
1807032	1808074	But can I ask you this?
1808594	1817769	Do you think it is possible for Jeremy Corbyn to negotiate a Brexit deal that is better for our country than remaining in the European Union?
1818671	1819412	Richard Burgon.
1819662	1826611	I believe that we can negotiate the best type of Brexit deal, and the people can decide between that credible Brexit deal.
1827052	1837666	But what I would say, Jo, what I would say with respect is, I think that the Liberal Democrats' policy of revoke if they got into government seeks to deepen divisions.
1837867	1838768	It's not very liberal.
1838968	1840270	It's not very democratic.
1840250	1843434	And there are lots of Lib Dem supporters or previous Lib Dem supporters who are very upset about it.
1843454	1846458	We're standing in an election and saying what we would do if we won the election.
1846478	1848201	I think that's democratic.
1848221	1854849	But you haven't answered the question whether you think it's possible that there could be a Brexit deal that is better than remaining in the European Union.
1855230	1858114	Well, look, the point is, Jo, that we...
1858134	1859516	The answer is no.
1859536	1862079	The point is, Jo, that it would be for the people to decide.
1862099	1867386	It would be for the people to decide, not the leader of the Liberal Democrats with 20 MPs or whatever.
1867406	1868848	It would be for the people to decide.
1868868	1869649	That's the point.
1869629	1887469	Thank you, Nicola Sturgeon.
1887449	1887930	They are on.
1888230	1891817	Brexit will cost people the length and breadth of the country.
1891837	1896867	And the alternative to giving people the chance to escape it is just to continue with the chaos.
1896887	1899552	I asked Rishi a question in the last debate we did.
1899572	1906184	Can you guarantee that next year, if a trade deal hasn't been negotiated, that we won't have a no-deal Brexit?
1906224	1910031	Will you take a no-deal Brexit off the table right now, yes or no?
1910011	1911433	Nicola, we had this debate.
1911453	1911814	We got a deal.
1911834	1912655	Well, you didn't answer it then.
1912695	1913216	No, no.
1913256	1914077	We got a deal.
1914197	1918002	You said, and I quote, you said it would be unachievable.
1918022	1918463	Nobody thinks.
1918503	1922348	You said it would be unachievable, your words, for Boris Johnson to get a new deal.
1922629	1923770	But he did achieve.
1923851	1924712	I'm talking about the future trade deal.
1924732	1924972	Hang on.
1925132	1927416	He did get a new deal, and you were wrong then.
1927836	1929038	Do you concede that you were wrong?
1929358	1930500	He did get a new deal.
1930480	1941483	I'm asking you, if there is no trade, nobody thinks a trade deal can be negotiated by the end of next year, so if you're right, fine, but if you're not right, do you think a no-deal Brexit will happen or will you rule it out right now?
1941503	1947575	We already have a deal to leave the European Union and of course we will finalise the details next year.
1947596	1948738	So you won't rule out no deal?
1948798	1950261	The point is...
1950241	1951523	We're talking about the future.
1952826	1958156	We can only get to that future and move on if we actually first respect the result of the referendum and leave.
1958497	1964068	You talked about a cliff edge at the end of next year.
1964088	1965651	It's going to give us independence.
1965691	1967254	I thought you liked independence.
1967234	1969136	We're going to be a free nation.
1969156	1974363	If Scotland was independent, we wouldn't be getting dragged out of the European Union against our will.
1974383	1976065	You can't be independent of me, innit?
1976085	1977187	But isn't the real key here?
1977467	1978208	Isn't the real key here?
1978568	1985717	Labour's referendum would give us a choice, would it not, Richard, of remain versus remain.
1985757	1995790	You don't even intend to give the voters a credible leave option, and that surely is a betrayal of five million of your own voters who voted to leave.
1995770	2000079	OK, answer that specific point, and then I'll come to both Sean Berry and Adam Frost.
2000099	2002002	It would be a credible leave option.
2002203	2004327	The Brexit Party talks about independence.
2004347	2004427	Yes.
2004447	2005750	There's nothing independent.
2005770	2005990	Absolutely.
2006010	2010219	There's nothing independent about taking your instructions on LBC when Donald Trump phones up.
2010439	2012884	There's nothing independent about that whatsoever.
2017589	2018811	Adam Price.
2018971	2020915	Sian Berry, you've been very keen to get in on this.
2021636	2021976	Thank you.
2022197	2026003	The Conservatives keep shouting out, let's move on and we got a deal.
2026484	2036180	And it's move on to the next cliff edge, they haven't got a deal, they've got a transition agreement and then we've never negotiated a trade deal in less than about five, seven years.
2036220	2038364	It took seven years to negotiate a deal with Canada.
2038384	2040087	These are more lies and more
2040067	2042830	slogans and people won't be fooled again.
2043190	2050958	Greens have been completely consistent in saying we need a people's vote, we need a ratification referendum and we will campaign for Remain.
2050998	2053881	I think that makes us represent the majority of people in this country.
2053901	2054762	Okay, Adam Price.
2054782	2061088	It's a terrible choice facing the two main Westminster parties, a no-deal policy on the one hand and with the Labour Party, no policy at all.
2061128	2063531	Here's a question, Richard, that possibly you can answer.
2063571	2065973	You probably do admire Tony Benn.
2065953	2073304	He used to talk about, didn't he, weathervane politicians that just go with the winds, et cetera, or the signpost politicians.
2073324	2074305	He was actually clear.
2074325	2076709	He was against the European Union.
2076989	2080054	But what we've got in the Labour Party now are weathervane politicians.
2080074	2083439	You won't even say, going into this general election, where you stand.
2083459	2084981	You say you'll consult your members.
2085001	2087064	You're not even able to be honest with the people.
2087385	2090309	Where's the leadership in that when we're crying out for it in this country?
2090890	2091471	Richard Burgess.
2095501	2104172	I'm disappointed that Adam is playing the Tory game by trying to blame Labour for the Tory-created Brexit crisis.
2104472	2106234	This isn't about not taking a position.
2106515	2108157	This is about taking the adult position.
2108617	2112082	In our country, there are families with different views on the question of Brexit.
2112102	2116007	There's people at work, work colleagues with different positions on this.
2116287	2122555	If we want to bring people together, I think we need less of the finger-pointing, ranting and electioneering.
2122535	2129965	And we need to say, let the people have the final say, and a Prime Minister, Jeremy Corbyn, will implement whatever the people say.
2130165	2130966	That's democratic.
2131026	2132087	That's going to bring people together.
2132107	2134090	I don't understand why people have such a problem with it.
2134110	2134310	All right.
2134330	2135452	Thank you very much, all of you.
2135472	2137534	Let's just do a quick reminder of the question.
2137554	2143222	It was about, honestly, whether your Brexit policy, your leadership, will bring this deeply divided nation and union back together.
2143262	2145184	Nigel Farage, if I can come to you.
2145164	2149629	What do you think, then, of the Conservatives' proposed deal?
2149669	2153154	You called it, at the beginning of the evening, a half-in, half-out fudge.
2153574	2154535	As it is, it doesn't work.
2154816	2156377	As it is, if it goes through...
2156518	2160663	If it's oven-ready and it goes through as it is, we're headed for years of misery.
2161043	2169433	Now, Boris Johnson said, after the election was called, that we would go back to Brussels and negotiate a free trade deal
2169413	2171617	in line with the Canada plus plus agreement.
2172058	2178410	If you stick to that and you amend the political declaration, then we will get something like Brexit.
2178731	2186787	If you carry on with the deal as it was, it is not Brexit, it will take years to deliver and millions of people will be very upset and disappointed.
2187087	2191135	So the question is, is it oven ready or are you going to go for a free trade deal?
2191300	2192201	Ritchie Soonack.
2192502	2195225	Nigel has been a tireless campaigner for leaving the EU.
2195245	2196387	I have, absolutely.
2196407	2202956	But the difference between Nigel and me is that only my party, the Conservative Party, can actually deliver Brexit.
2202976	2203817	What are you going to deliver?
2203917	2210426	A vote for anybody else on this stage, including your party, Nigel, is just going to mean Jeremy Corbyn in number 10.
2210526	2215874	And that's going to mean no Brexit and years more led delay, division, and deadlock.
2215894	2218337	Are you going for a free trade deal, yes or no?
2218317	2219439	Thank you, gentlemen.
2219659	2223806	Well, I'm just going to ask Rishi Sunak to address that direct question.
2224608	2228374	We want a deep and comprehensive economic and security partnership with Europe.
2228414	2232000	It's outlined already in the political declaration that's been negotiated.
2232221	2238872	And it means we can leave the EU intact as one union in control of our laws, our borders, and our trade policy.
2238932	2242418	And that's something that the British people finally want us to get to.
2242398	2259563	I mean what was negotiated was even much less close agreement with the rest of the European Union than what Theresa May put forward because you watered down any of the what were inadequate protections on workers' rights, on environmental protections and the only possible conclusion
2259543	2263931	can be is that's because a Conservative government would want to rip up workers' rights.
2263951	2274750	It's absolutely the case that that's what the Conservatives want to do and that's why it's so dangerous for people in this country who are wanting to make sure that their hard won rights are not going to be sold down the river.
2274730	2278994	OK. Just briefly, Adam Price, and I want to come back to a different part of the question.
2279274	2290706	Another thing Nigel Farage said before he had his Damascene conversion at the beginning of the campaign was you said that, actually, the deal on the table from the Conservative government is virtually worse than remaining within the European Union.
2290726	2300635	Now, if that's true, surely the right thing to do is ask the people again, is this the Brexit that you really wanted, or not the fantasy Brexit, the actual Brexit on the table?
2300816	2302257	Is this what you thought you were voting for?
2302237	2307505	Brexit is leaving, which would mean in Wales we could help the steel industry.
2307825	2309387	In Wales you could help the fishing industry.
2309708	2311470	So much better we could do outside.
2311831	2316057	Leaving means we do not have the European Court of Justice ruling over our country.
2316257	2318461	The problem with the deal on the table is that it would.
2318781	2319762	That needs to be amended.
2319822	2321545	If it is, it'll look like Brexit.
2321765	2324329	If you leave it, Rishi, as it is, it's not Brexit.
2324309	2334862	OK, let's just return to the question because there's a very important point raised within it about Brexit policy and whether your leadership could bring this nation back together and indeed the union back together.
2334882	2338106	It is on very many people's minds ahead of this election.
2338527	2351042	Richard Burgon, there are those that would say by offering potentially a second independence referendum, which is what Nicola Sturgeon would request in return for some support if you needed it in government, how committed are you to the union?
2351377	2357006	Well, there's going to be no backroom deals, frontroom deals or any other kind of deals with the SNP or anyone else.
2357327	2362455	We're going for, and I believe we can and will get, a majority Labour government.
2362716	2373233	And so we do not have the position of having a second independence referendum in Scotland in the early years of a Labour government.
2373213	2383344	Well, look, as I said a moment ago, if the union is as strong as some people say it is, then how can Scotland be in a position of facing being dragged out of the European Union against our will?
2383744	2385526	We stand at a crossroads right now.
2386027	2398420	Down one path, Scotland has the prospect of our future being decided for us by Boris Johnson and Nigel Farage, or we can have the option of deciding a different future as an independent country where we're in charge of our own destiny.
2398460	2400402	I think that is a much brighter prospect.
2400422	2402865	On the question of Labour, I'm not asking
2402845	2422609	Richard Burgon or Jeremy Corbyn to support independence but I would be asking them if the SNP hold the balance of power to respect Scotland's right to choose, to respect the fact that that is a decision not for Westminster but for the people of Scotland and I don't think they'd turn their back on the chance to govern just to block Scotland's right to choose.
2424698	2436640	In response, just as we don't believe the real divide in our society is between people who voted Leave and Remain, neither do we think the fundamental divide in our society is between whether someone lives in Newcastle or in Glasgow.
2436920	2438984	We don't support independence of Scotland.
2439225	2440547	We would argue against it.
2440527	2458587	I also believe that when austerity is ended under a Labour government, when Scotland gets its fair share of a growing economy under a Labour government, that may make people realise that there is an alternative in Scotland, in the United Kingdom, with a progressive Labour government looking after the many, not the few.
2458567	2473622	Nicola
2473602	2476126	tended to stand up for the United Kingdom too.
2476266	2493872	And now we have a Labour party that is saying they're going to have a second independence referendum, and a Conservative party that has quite shockingly said that they will put a border down the Irish sea, despite all of the promises and pledges that we heard from Boris Johnson that no Conservative prime minister should ever agree to that.
2494192	2495514	And they've gone ahead and done it.
2495775	2499680	So neither of those parties can truly be saying they're standing up for the United Kingdom.
2499721	2502765	Let's allow Rishi Sunak to respond to that issue about Northern Ireland.
2502745	2510064	Well, our deal actually allows the United Kingdom to leave the EU intact as one UK and respect the result of the referendum.
2510225	2518105	What would be bad for the Union is to spend years more arguing about referendums on Brexit again and on Scotland.
2518085	2519168	That would be divisive.
2519228	2520431	It would not bring people together.
2520451	2534305	And maybe if I could pose a question, because hearing about all these deals, Nicola, if you are going to be ending up propping Jeremy Corbyn in number 10, and we have all these second referendums, which one will you insist comes first, the one on Scotland or the one on Brexit?
2534285	2539711	Well, I support a second Brexit referendum, because I actually think everybody in the UK should have the chance to escape the mess.
2539751	2544997	But fundamentally, it's for Scotland to decide our own future, because it's not right.
2545057	2551604	And perhaps you can explain why you think it's right for Scotland to face exit from the EU when we overwhelmingly voted against that.
2551964	2554948	I respect the fact that people here don't support independence.
2554968	2556830	That's legitimate to oppose it.
2556870	2561575	But what's not legitimate is to deny the people of Scotland the right to be in charge
